제목,내용요약
"오늘의 소식 (Aug 22, 2018)","쇼핑몰/호텔 복합몰 기대 - 삼성전자, 의류관리기 에어드레서 공개 LG스타일러에 도전장 - 일렉트로룩스 아시아 최초로 한국서 신제품 공개. 국내 무선청소기 국내판매 급증 여파 - 현대 모비스 자율주행..."
패딩에 경유를 묻혔는데 도움 좀 주세요ㅠㅠ,안타티카 새걸로 구매했는데 주유하다가 왈칵 튀어나와서 소매쪽에 묻었는데 에어드레서로 한번 돌렸는데도 냄새가 나네요 이거 해결할 방법 없을까요..ㅠㅠ 아니면 그냥 올겨울 다 입고 드라이 맡기면...
이모들 안농~,"지금 갑자기 필요한게 두가지 생겼는데 빨래건조기, 에어드레서인데 써보신 분들 좋은지 글좀 남겨주셔요~ 결혼해서 10년이 넘어가니 가전제품도 슬승 맛탱이가고 돈덩이..."
"[공식앱][폴로 블루 플래드 셔츠 S][15,000원]",세탁 후 에어드레서에 돌려서 보내드립니다 대구 동성로에서 직거래 가능 +거래지역 : [거래 전에 꼭! 확인하세요]- 해당 상품은 중고나라 공식앱을 통해 카페에 함께 등록된 상품입니다.- 카톡이나 다른...
RH14WH LG트롬건조기 14키로 새상품 팝니다,삼성 큐브 청정기 LG퓨리케어 청정기코드제로 다이슨V10앱솔루트 엑스트라삼성 에어드레서판매도 가능합니다 판매자 연락처 보시면 공개해놨으니 전화나 문자 카톡 등으로...
RH14WH LG트롬 건조기14키로 새상품 팝니다,삼성 큐브 청정기 LG퓨리케어 청정기코드제로 다이슨V10앱솔루트 엑스트라삼성 에어드레서판매도 가능합니다 판매자 연락처 보시면 공개해놨으니 전화나 문자 카톡 등으로...
현대큐밍 *삼성 에어드레서,오늘에 인기추천상품 상담및 관심있으신분 연락부탁드립니다. *** **** **** 박혜영 메니저입니다. 지원 팍팍해드릴께요.모든레탈가능합니다#렌탈#정수기#비데#침...
DF60N8700MG 에어드레서 견적문의,DF60N8700MG 견적문의드립니다.
◈ 미리 알아보는 힐스테이트 초전 입주박람회 프리미엄 & 럭셔리...,"필수가전으로 자리잡고 있는 ""건조기"", 핫 이슈 중심에 있는 ""에어드레서"", 건강과 생활을 생각한 ""공기청정기&quo..."
"[오늘마감] 아이패드, 삼성 노트북, 에어드레서, UHD TV 최저가","- 전제품 인터넷 최저가!- 36개월 무이자 할부에 36개월 AS지원까지- 제휴카드 사용 시 36개월 간 월 17,000원(총 612,000원) 추가 할인 - 오늘(2월 11일) 마감 상담/문의 *** **** ****http..."
매일 정장입는 직종인데..,LG 스타일러 VS 삼성 에어드레서 뭐가 더 나을까요?
스타일러 vs 에어드레서,어떤게 더 좋나요?
"대명아임레디 대명상조순위 업그레이드 가전제품(냉장고, 건조기...",김치냉장고삼성 에어드레서(브라운)삼성 노트북9 Always삼성 애드워시 드럼세탁기 21kg브람스 안마의자 S880가 추가되었습니다. 이번엔 상당히 많이 추가되었네...
가전제품 구입하고왔어요~,이사가는김에 이것저것 구입했어요~ 사고싶은 에어드레서도사고 할인도 사은품도 많이받고 역시 돈쓰러 다니는게 젤로좋네요ㅋ
차산지 며칠안됐는데,차산지 얼마안됐는데 지금사면 에어드레서를 준다하니 아꿉네요 .. ㅠ
★전자랜드 검단점 4주차 행사★,삼성 에어드레서 색상도 다양하게 이제는 옷관리 뿐만아니라 제습도 문을 닫고 편하게! 사전예약시 공기청정기 사은품 증정! 휴대폰도 역시 전자랜드! 갤럭시 노트9즉시...
**2018년 베스트 상품을 올립니다.**,스타일리시로 잘알려진 삼성 에어 드레서 입니다. 드라이하는데 목돈 들어가셨죠? 이젠 걱정마세요 에어로 드라이 하세요 아이들 교복 부터 아빠들 양복 바지 다림까지 ...
혹시 가전제품 땡치는 업체 연락부탁드립니다,대형 및 특수시장에 판매가능하신분 연락부탁드릴께요 냉장고.세탁기.에어컨.TV 기본가전 사이니지.에어드레서.노트북 특판상품 가전에 대해서 대량 판매 가능하신분 꼭 연락주세요 *** **** ****
바른손카드 청첩장 샘플 받아보았어요:),"금액이 적힌건 아니고, 가장 최근에 출시된 제품군 위주로 세탁기, 냉장고, 에어드레서 등등 내용이 적혀있었어요. 그리고 카드 만들고 받을 수 있는 혜택도 적혀있었..."
왔어요 왔옹,드뎌 에어드레서가 왔어요 이제 매일매일 패딩이랑 겉옷 돌리고 산뜻하게 입을수있겠어요 매일 입고 들어온 겉옷 사실 건조기 털기로 돌렸는데 사실 귀찮았음 ... 바로...
스타일러 샀어요,엘지 스타일러샀어요!^^ 에어드레서랑 고민했는데 스타일러의 의류살균작동법은 엘지가 특허를 냈다고하더라구요 그래서 삼성은 털기방식을 못한다고 들었어요~ 그것도그거지...
▣ 김포 풍무동 신규현장 ▣,"◆전세대 삼성전자 IOT풀옵션 (삼성 에어드레서, 삼성 빌트인냉장고, 삼성 쿡탑, 삼성 드럼세탁기, 삼성 LED TV 등) ◆이마트 트레이더스, 홈플러스 등 편리한 생활 인프라! ▶19년 1월 21일..."
추석때 부모님 선물사드리려하는데 건조기 vs 스타일러,이번 추석에 부모님 선물사드리려하는데 둘다 자기돈으로 사긴 아깝고 있으면 요긴하게쓴다고 알고있는데 뭘 사드려야할지 고민되네여 건조기 vs 에어드레서(스타일러) 뭐가 더 나을거같으세여? 가격은...
삼성 안심가전 체험단 모집,"삼성에서 에어드레서, 그랭데건조기, 삼성큐브 세 제품에 대한 체험단을 모집중이네요. 관심있으신분들은 참가해버세요 ! 전 그랑데 건조기 한번 써보고 싶네요 ㅠㅡㅠ"
미세먼지 심할 때,미세먼지 심할 때 옷이나 가방 관리 하시는 노하우 있을까요?생각같아선 등산로 입구에 있는 에어총(?)같은거 집앞에 구비하고 싶어요.에어드레서를 놓을 공간이 없는 사람은 웁니다... 물론 구입 비용도...
삼성가전 체험단 모집한데요~ 신청해보세용 ㅎ,"식기세척기는 밀레꺼 쓰는데 긴가민가해요 ㅋㅋ 이번에 삼성에서 에어드레서랑 건조기, 공기청정기 체험단 모집한데요~ 우리 같이 한번 신청해봐용~ 혹시나 당첨되면 당첨글 남길꼐요..."
삼성 에어 드레서 골드 미러 특가전,
2018 삼성의류케어 행사초청 이벤트,2018 삼성 의류케어 제품과 함께하는 HOME BRUNCH 행사 초청 이벤트! 신상템 에어드레서 외 푸짐한 경품 증정 : 네이버 카페 http://naver.me/FMX1kDET
이번주일요일 신혼여행에서 입을 옷 입어봤어용,저희 신혼여행은 칸쿤이라서 빨리 여름나라가서 놀고싶네요 ㅠㅠ 집에 아직 거울이없어서 에어드레서앞에서 실컷입어봣어요 ㅋㅋㅋㅋㅋㅋ 에스닉패턴 좋아해서 죄다 화려해요 ...
뭔가 잘못드신 진상님 ㅋㅋ,저번주에 벌써 하이마트는 두곳 다녀왔거덩 ~ 이번 주말에 견적 좀 더보고 구입하렵니당 LG냐 삼성이냐 것도 좀 더 고민 좀~ 사실 에어드레서로 좀 기울긴 했지만 ...
나눔글 다시올립니다~,제가 어제 템퍼매트리스/ 삼성에어드레서 10만원권 나눔글을 올렸는디 에어드레서 특이사항을 확인하지 못한채 올려서 혼동을 드린것같아요 ㅠㅠ 정리하자면 1. 템퍼매트...
스타일러 고민,LG스타일러가 3개와5개 들어가는게 나오고 삼성에서 에어드레서가 나오던데 겨울이 다가오고 이사갈 예정이여서 장만할까 생각중인데 어떤게 나으세요? 써보신분들의 솔직한 후기...
삼성 에어 드레서 골드 미러 특가전,
에어드레서 출시~~,"세탁소 갈 필요없이 집에서 의류관리 비용도 시간도 모두 아껴줘요~ 1.제트에어,스팀으로 리얼케어 2.미세먼지필터로 털어낸 먼지까지 리얼청정 3.냄새분해필터로 털어..."
삼성디지털프라자 강남본점 가전 상담하고 왔어요^^,(에어드레서는 지인분께서 사주신다하셔서 품목에서는 제외했습니다.) 지금 웨딩이벤트 기간이라구 공기청정기와 삼성유선청소기를 증정해주신다구 하더라구요. 먼저 냉장고는...
"""고마운"" 삼성에어드레서",
"신혼집 인테리어 전, 후 후기",지저분해보이지 않을까 했는데 커텐이 달려있어서 부모님들이나 손님들 오실 때는 깔끔하게 닫아놓을 수 있어요. 서랍장과 에어드레서까지 딱 놓으니 아담하고 깔끔한 분위...
가전 견적좀 봐주세요~,DV16R8540KV 에어드레서 - 삼성(우드브라운컬러) DF60N8500BG 에어컨 -LG 스탠드(2 in 1) FQ17V8KWB2.AKOR 다이슨 V10(앱솔루트프로) 혜택전 총 금액이 1030-1040만원정도였어요(정확하게 기억이 ㅠㅠ)...
신규 오피스텔 분양 본부 모집합니다!!,"◆전세대 삼성전자 IOT풀옵션 (삼성 에어드레서, 삼성 빌트인냉장고, 삼성 쿡탑, 삼성 드럼세탁기, 삼성 LED TV 등) ◆이마트 트레이더스, 홈플러스 등 편리한 생활 인프라! ▶19년 1월 21일..."
"♡CJ헬로렌탈입니다^^♡장기할부 청소기,스타일러 안내해 드립니...","New삼성 에어드레서 (DF60N8700MG) 골드미러/상의3벌+하의3벌/36개월약정월 62,000원기본가 63,000원 New삼성 에어드레서 (DF60N8500..."
신혼집 입주 후기입니다!,"대신 커튼행거 설치했고, 공간이 남아서 에어드레서도 구매했어요! 요건 좀 만족하고 사용하고 있는데, 그래도 셔츠는 다려야 하더라구요.. ㅋㅋㅋㅋ 집이 작아서 크게..."
결혼준비로 한창이네요..,L사에 있는 스타일러를 생각하고있었는데 S사에 에어드레서라는 똑같은제품이나왔더라구요 ㅎㅎ 싱기해서 사진한컷!! 한번 이벤트도 참여해보고 사은품준다니 다음달에 또와...
삼성 에어드레서 구매하신 분들,LG꺼랑 삼성 꺼랑 고민중인데 뭐가 좋을까요?!백색은 대부분 LG가 나았어서 고민중인데 삼성께 실크하고 가죽케어가 된다고 해서 생로랑이나 하이더 아크만 의류들 때...
삼성 에어드레서 구매하신 분들,LG가 이미 특허낸 기술 겹치면 안되서 요리조리 피하느라 완성도 떨어진단 얘기가 많아서 LG 스타일러하고 고민중인데 혹시 2제품다 실사용 해보신분들 계신가요?! ...
[삼성페이쇼핑] 삼페쇼핑특가 연말이벤트 삼페쇼핑감사제,하나는 삼페쇼핑 ~ 라서 좋았다 등의 의견 적기!저도 에어드레서가 탐나서 참여 했어요! 두 번째는 삼페쇼핑 구매만 해도 자동응모!삼페쇼핑으로 자주 구매하시는 분들...
☆안녕하세요 CJ헬로렌탈입니다 ☆ 스타일러 장기할부 안내드려요,"삼성 에어드레서 (화이트) (DF60N8300WG) 인버터/상의3벌+하의3벌월 52,000원(36개월 납부기준) 삼성 에어드레서 (로즈) (DF60N8500RG)..."
에어드레서나 스타일러 있으신분 잘쓰시나요?,지금 살까 말까 고민중인데요 집에 있는 분들 사용 잘하시나요?
견적 문의 드립니다^^*,AKR) - 돌비사운드 있는 모델! 냉장고 LG F871MS55H.AKOR 홈스타일러 LG 3벌 블랙 (-> 에어드레서랑 두개다 비교 견적 부탁드려요~!) 청소기 다이슨 v10 카본파이버 견적부탁드립니다 ^^*
"렌털업계 '커진 LG 존재감'…""고맙지만 얄미워"" 왜?",올해 교원 웰스사업본부장을 삼성전자 출신인 신동훈 사장이 맡으면서 양사 간 협력이 증가하는 추세다. 현대렌탈케어도 삼성전자의 의류청정기 '에어드레서'를 렌털 상품...
LG트롬 건조기14KG RH14WH 미개봉 새상품 판매합니다,"삼성에어드레서 LG스타일러 삼성,엘지 세탁기 다이슨 등등 최대한 싸게 구해드리겠습니다 이전 거래내역 확인필수!! 공일공 99오구 56오칠 문자 전화 주세요 댓글 ..."
삼성 에어드레서 구매하신분들 도움좀 주세요 ㅜ,집앞 하이마트 가봤는데 200에 캐싀백 20되고 180이라는데 아무래도 호갱같아서요 구매하신 디매형님들 얼마에 사셨는지 구매처 정보 좀 알려주세용 ㅜㅜ
LG 스타일러 VS 삼성 에어드레서,세살이 끝내고 이사를 가려고 해요. 의류관리기 하나 사고 싶은데 사용해보신 분이나 추천해주실 분 계신가요? 이왕이면 디자인도 고려하고 싶어요
삼성 에어드레서 구매했습니다!,지금 사전예약 걸면 30만원짜리 공기청정기 준다해서... 바로 구매했습니다 색상은 4종류인대 거울이 가능한 제품인 가장 비싸더라구요.... 미러가 이쁠거 같아서 ...
춘천 육림고개 맛집 핫플레이스 메이샤1990,메이샤1990 대박이에요 자리 뒤에보니 에어드레서가 있어요... 사장님 말로는 강원도 최초로 식당에 두신거라는 ... 이사장님 젊은대 .. 센스가 터져요 ... ...
ㅠㅠ?,에어드레서 사서 매일 옷 냄새제거 2. 호르몬 영양제 복용하기 3. 냄새제거 비누? 같은게 있던데 그걸로 씻기 + 은은하면서 어머니도 쓰실수있는 향수 추천도 부탁드려보아요 ㅠㅠ 제가 향수를 안써서...
★★ A급 리퍼 ★★ sk매직 직수 냉온정수기 wpu-a200c,"직수냉온정수기,슈퍼정수기,WPUA300,제습기,퓨리케어 정수기,직수냉온정수기,슈퍼S정수기,올인원정수기,올스텐정수기,퓨리케어360,브리타필터,브리타정수기,lg스타일..."
★★ A급 리퍼 ★★ sk매직 직수 냉온정수기 wpu-a200c,"직수냉온정수기,슈퍼정수기,WPUA300,제습기,퓨리케어 정수기,직수냉온정수기,슈퍼S정수기,올인원정수기,올스텐정수기,퓨리케어360,브리타필터,브리타정수기,lg스타일..."
★★ A급 리퍼 ★★ sk매직 직수 냉온정수기 wpu-a200c,"직수냉온정수기,슈퍼정수기,WPUA300,제습기,퓨리케어 정수기,직수냉온정수기,슈퍼S정수기,올인원정수기,올스텐정수기,퓨리케어360,브리타필터,브리타정수기,lg스타일..."
인테리어 후기 :) 가전 드럼세탁기 26kg,드레스룸에 에어드레서 넣었어요 여러분ㅋㅋㅋㅋㅋㅋ에어드레서도 꼭사세요 신세계에요ㅋㅋㅋㅋㅋ 에어드레서 너무이뻐요ㅋㅋㅋㅋ저 드레스룸 넘 맘에들어요ㅋㅋㅋㅋㅋㅋㅋㅋ 그래서...
용달배송{배송비구매자부담})판매완료,"개인거래(판매), 판매완료, 가격 1,000,000원, 안전거래 미사용, 용달배송{배송비구매자부담})삼성 에어드레서 새상품 골드밀러 판매합니다., 기존 아이디는 ..."
[열반 16기 니나누 #53] 2.3 신문용어정리-솔로이코노미,삼성전자의 의류청정기 '에어드레서' 역시 슬림한 크기에 전신거울 기능을 겸하도록 외관 디자인에 '골드 미러'를 적용하며 소형 가구를 겨냥했다. LG전자는 아예 자...
LG트롬 16KG 건조기 RH16VH 미개봉 새상품 판매합니다,"삼성에어드레서 LG스타일러 삼성,엘지 세탁기 다이슨 등등 최대한 싸게 구해드리겠습니다 이전 거래내역 확인필수!! 공일공 99오구 56오칠 문자 전화 주세요 댓글 ..."
"마제스틱 청소기 (사용회수1회) , 교환도 가능","보시고 구매하셔도 됩니다.~ 자세한 내용은 첨부했으니 참고하세요. ------교환품목------- ☆ 바디프렌드,6인용 식탁 스타일러, 에어드레서,삼성드럼세탁기 ..."
[코웨이]이것만은 알고 제품 렌탈하자 - 의류청정기편 -,"은마서 어머님들코웨이 본사 영업팀장 김선구팀장입니다즐거운 명절되셧나요!오늘은 의류청정기 삼국시대라 불릴만큼 인기리에 판매되고있는스타일러(LG),에어드레서(삼성),..."
"사기엔 아까운 LED마스크, 음파운동기 비에스렌탈로 이용하자!",이 외에도 공기청정기 노트북뿐 아니라 요즘 엄청난 화제가 되고 있는 삼성 에어드레서까지 있으니 비에스렌탈에서 만나보세요 비에스렌탈에서 하나카드와 우리카드 제휴를 ...
하이마트 오픈점 행사 할인 견적 받았어요,냉장고 : 삼성 4도어 T9000 rf85n9642g2b 세탁기 : LG 21키로 F21VDW 건조기 : LG 14키로 RH14VH.Akor 에어드레서 : 삼성 DF60N8700mg 티비: 삼성 Qled 65인치 QN65Q7FNHFXKR 최종혜택가가 800만원 후반입니다....
오정점 오픈 16주년 마지막 파격세일!!행사!!!!,"LG스타일러,삼성 에어드레서 좋다는거 많이 이야기 들으시죠??? 추가로 LG 프라엘!! 제휴카드 혜택시 최대 38만원 캐시백 혜택까지 받아보실수있는 기회!!! 꿈..."
제휴-전자랜드]창립 30주년 특별세일 김치냉장고 스탠드 89만원부...,요즘 이슈상품인 김치냉장고부터 30주년 임직원가행사중인 안마의자 주부님들의 워너비 ITEM 삼성 엘지 텀블건조기까지 전품목 스타일러와 에어드레서등 의류청정기 거실...
세탁기 어디제품 쓰세요?,사는데ㅠ이번에 에어드레서랑 그랑데 건조기 샀는데 배송전이라 다 환불하고 LG로 스타일러랑 건조기로 진심 바꾸고 싶네요이런경우 있으신분 공유좀 부탁드려요 다른 사람...
오늘 저도 트롬 스타일러 지르고 왔지요♡,"간거부터가 이미 시작이라며ㅠㅠㅋㅋ 에어드레서냐, 스타일러냐 고민 하다 결국 스타일러 결제까지 하고 왔네요;; 여자들보단 남자들의 만족도가 더 높은 가전 제품이라던..."
삼성 디지털프라자 간석점 OPEN 이벤트!,(따끈 따근한 신제품!!!)노트9 즉시 구 매 가 능 !!방문고객 구매시 특별한 사은품 증정!~에어드레서 예약구매시 30만원 상당 공기청정기 증정!~ 가까운 지인...
"졸업_입학선물은 가자,전자랜드양주점! [구정맞이 노트9,8,외 특...",*삼성에어드레서 제트에어로 겉과속을 확실하게 털어내고 필터로 털어낸 먼지&냄새 제거까지 ♥ ◆김치냉장고/S/A/L/E◆ㅡ 오리지널 땅속냉각+독립냉각 한겨울...
2월 2주차 특가 가전행사 안내 (인터넷 최저가 보다 싸다!),"(제휴 카드결제할인 10만원 포함)(선착순 3명 한정) 다섯번째, 삼성에어드레서 제휴카드 결제시 인터넷보다 싸다! 삼성 최고급 미러형 에어드레서DF60N8700M..."
(판매완료) 몽클레어 / 그레노블패딩(GREY) / 3사이즈,있는옷입니다 저렴하게 분양합니다 동탄역직거래를 원칙 직거래시 만원네고 택배거래 쿨거래시 택배비 제가 내드리겟습니다 좋은가격입니다 에어드레서 돌려놧습니다 포장상태로...
하이마트 견적좀 봐주세요~,삼성 t9000 냉장고 (인터넷 최저가 290정도) 에어드레서 공기청정기 삼성 큐브 RH14vh 엘지 건조기 14키로 엘지 드럼 17키로 청소기 코드제로 알파 나인?(정가 100정도. 물걸레 별도) 카드할인까지 해서...
전자랜드 쌍용점)) 전자랜드 쌍용점에서 준비한 2019년 첫 행사!...,"1.건조기, 스티일러, 에어드레서, 드럼세탁기, 전자동통돌이세탁기 삼성, LG, 대우, 등 다양한 메이커의 제품 고민 할 필요 없는 가격에 만나 보실수 있습니다...."
힐스테이트 새집증후군시공- 2018년 12월14일,"가스설치 기사님, 전기렌지 설치 기사님이 줄줄이 들어오십니다시간이 좀 지나니 고객님께서 오시네요ㅎㅎㅎ전날에는 입주청소완료되자마자..에어드레서, 김치냉장고가 들어왔..."
전자랜드 쌍용점)) 전자랜드 쌍용점에서 준비한 2019년 첫 행사!...,"1.건조기, 스티일러, 에어드레서, 드럼세탁기, 전자동통돌이세탁기 삼성, LG, 대우, 등 다양한 메이커의 제품 고민 할 필요 없는 가격에 만나 보실수 있습니다.2.김치냉장고 삼성, LG, 딤채, Klasse..."
▣ 김포 풍무동 신규현장 ▣,"서울 보증보험 증권 발행!◆풍무 2지구의 핵심 입지!◆전세대 삼성전자 IOT풀옵션 (삼성 에어드레서, 삼성 빌트인냉장고, 삼성 쿡탑, 삼성 드럼세탁기, 삼성 LED TV 등)◆이마트 트레이더스..."
이벤트종료/ 삼성대치동 메가스토어 오픈 삼성전자 혼수가전 이벤...,"냉장고, 김치냉장고, 가전제품 바꾸실 분들은어서어서 결혼이야기에 쿠폰 신청을 서둘러 주세요~~~ 또한, 이번에 삼성에서 에어드레서를 런칭하며 특별 행사도 합니다...."
GGS스테인레스 냄비3set,ak백화점에서 에어드레서 사고 받은 사은품인데 오늘 도착했어요. 냄비많아 싸게 내어놓아요. 냄비한개만해도 10만원 넘을건데. 동탄신도시에서직거래가능하고 택배는착불...
에어드레서 써보신분 계신가요??,쓸만한가요??
"가전제품 절반값!스타일러,초특가 sk매직식기세척기12인용,건조기...",1.쿠쿠안마의자 모델명 cms-c10dr 350만원》130만원대 2.sk매직 식기세척기 터치온uv 》80만원 3.sk매직 모델명 MMC150CR1EBL 450만원...
삼성 75인치 UHD TV판매합니다. 미개봉 새제품+단순개봉제품 등....,간단한 인증조차 꺼려하시는분들은정중하게 사양하겠습니다.예) 신분증상 주소와 배송주소 일치여부등 문자 전화주세요***-****-**** 삼성 그랑데건조기 이녹스색상...
LG트롬건조기 RH14WH 미개봉 새상품 판매합니다,"삼성에어드레서 LG스타일러 삼성,엘지 세탁기 다이슨 등등 최대한 싸게 구해드리겠습니다 이전 거래내역 확인필수!! 공일공 99오구 56오칠 문자 전화 주세요 댓글 ..."
"""고마운"" 삼성에어드레서",
"""고마운"" 삼성에어드레서",
"""고마운"" 삼성에어드레서",
"""고마운"" 삼성에어드레서",
LG트롬건조기 RH14WH 미개봉 새상품 판매합니다,"삼성에어드레서 LG스타일러 삼성,엘지 세탁기 다이슨 등등 최대한 싸게 구해드리겠습니다 이전 거래내역 확인필수!! 공일공 99오구 56오칠 문자 전화 주세요 댓글 ..."
K7 견적요청드립니다.,"빠르게 견적을 받는 대신 여러 곳에서 연락이 올 수 있습니다) * 구매방법(현금,할부,장기렌트 등) :1500만원 현금+ 36개월 0.1프로 할부 * 기타문의 사항 : 기타 제반사항 및 삼성에어드레서 제공"
김포 풍무동 신규현장,"서울 보증보험 증권 발행!◆풍무 2지구의 핵심 입지!◆전세대 삼성전자 IOT풀옵션 (삼성 에어드레서, 삼성 빌트인냉장고, 삼성 쿡탑, 삼성 드럼세탁기, 삼성 LED TV 등)◆이마트 트레이더스..."
희망사항 가전♡,"예뻐요 너무 ㅠㅠ 에어드레서는 꼭꼭 사고 싶은데, 이렇게 전면이 미러이면 전신거울의 역할도 하고 너무 좋을 거 같아요~ (전면이 거울인것과 아닌것의 금액차이가 꽤..."
▣ 김포 풍무동 신규현장 ▣,"서울 보증보험 증권 발행!◆풍무 2지구의 핵심 입지!◆전세대 삼성전자 IOT풀옵션 (삼성 에어드레서, 삼성 빌트인냉장고, 삼성 쿡탑, 삼성 드럼세탁기, 삼성 LED TV 등)◆이마트 트레이더스..."
하이마트 이번 주말에 꼭 들려봐야하는 이유는~!!!,"1,540,000원삼성 에어드레서 1,890,000원삼성 UHD TV (189㎝) 2,700,000원 (163㎝) 1,640,000원대우드럼세탁기 799,000원..."
서부광역철도 바로앞 우장산 아덴하임 오피스텔,"(LG유플러스 IoT 시스템과 건조기, 에어드레서, 전자레인지 등이 제공..) 서부광역철도라인(예정)바로앞! 마곡,상암,홍대수요까지... 우장산 아덴하임 오피스텔..."
휴스톰 듀얼 시스템 스팀 다리미 판매해요~,"개인거래(판매), 판매완료, 가격 50,000원, 안전거래 미사용, 휴스톰 듀얼 시스템 스팀 다리미 판매해요~, 올해 구입해서 실사용은 5번 정도 되구요~부속품은..."
코트 판매합니다.,옷이 너무 많아서 작은옷들 판매해요. 보관용옷들이라서 드라이는 따로 안했구요. 구매하시면 에어드레서로 옷먼지제거는 간단하게 해드릴께요. 목동입니다.
코웨이의류청정기 미러실버 오군렌탈,최근 의류관리기 제품이 인기가 좋은데요 엘지스타일러를 시작으로 코웨이의류청정기 그리고 삼성에어드레서까지 다양한 의류관리기들이 등장하고 있어요 오염된 옷 그리고 옷...
우장산 아덴하임 오피스텔 분양가,"(LG유플러스 IoT 시스템과 건조기, 에어드레서, 전자레인지 등이 제공..) 서부광역철도라인(예정)바로앞! 마곡,상암,홍대수요까지... 우장산 아덴하임 오피스텔..."
LG트롬건조기 RH14WH 미개봉 새상품 판매합니다,"삼성에어드레서 LG스타일러 삼성,엘지 세탁기 다이슨 등등 최대한 싸게 구해드리겠습니다 이전 거래내역 확인필수!! 공일공 99오구 56오칠 문자 전화 주세요 댓글 ..."
미샤 프리스티지 캐시미어 100코트,상품 아울렛 컨디션입니다.에어드레서에 모셔두어 깨끗합니다. 55싸이즈이고 연말에 격식있는 자리에 뽐내실만한 인기 많았던 상품이에요. 궁금하신건 문자주시면 더 많은...
