제목,내용요약
삼* 에어 드레서랑 L* 스타일러 먼차이에용?,쓰시는분들 어떤게 좋은지 추천좀해주세요 찾아봐도 둘다 장단점이많아 더 어렵네요
삼성 에어드레서 의류관리기 S3MF,삼성 에어드레서 의류관리기 S3MF 고급스러움이 감도는 블랙 틴트 컬러의거울 소재로 공간을 더욱 빛내주며스타일링한 옷을 꺼내 입을때옷매무새를 바로 확인할수 있어 ...
삼성 에어드레서,요즘 광고하네요~ 삼성에서는 안나오나보다하고 스타일러라도 사야하나 했는데요 혹시 에어드레서 구매하셔서 쓰고 계신분 있으세요?? 실사용후기가 궁금해지네요^^
의류관리 가전기기 삼성전자 '에어드레서' 출시,"정승원입니다.이번에 김한솔님, 한솔님, 저와 서지연님이 함께 GUI를 작업한 에어드레서가 이번에 출시되었네요.관련 소식 공유해드립니다.---------- “미세먼지 잡는 ‘진짜’ 의류 청정”…에어드레서 최초..."
삼성 에어드레서(미러) 같이 사실 분 계신가요?,지금 행사기간인데 미러 제품 두대사면 할인이 좀 더 되더라구요~ 삼성카드로 6개월 무이자예요~ 전 사려고 하는데 혹시 같이 살 생각있으신분 계시면 오늘까지 챗주세...
스타일러나 에어드레서....,[※글 작성시 배너를 삭제하시면 활동정지 대상이오니 유의하시기 바랍니다 / ※내용은 배너와 배너 사이에 작성해 주세요] 요즘 관심이 가서 보고 있었는데 블로그나 인스타에는 전부 설레발 글들에........
인테리어 후 뒤늦은 의류관리기 구매... 빌트인느낌나게 ..약간 ...,그래서 또 간만에 공구꺼내 옷장 리폼 해서 빌트인 느낌으로 에어드레서로 설치 했어요!! 붙박이 장과 마주보고있는 가벽겸 옷장인데 에어드레서 놓을만한 공간이 안나와...
삼성 에어드레서 갖고싶어요 . ~~ 체험단 !!원츄,새로 이사한 집 드레스룸에 에어드레서 쏙 - 넣고프네요 . 미세먼지 걱정없이 안심살균할 수 있도록 말이죠 삼성체험단 만나보세요 . https://www.samsu...
[공식앱][삼성 에어드레서 최고급형 골드미러 미사용 새제품 급처...,
스타일러vs에어드레서,스탈러나 에어드레서 살 예정인데 뭐가 더 괜찮을까요~~~^^
"의류관리의 시작, 삼성 에어드레서 사전 예약판매","카페 정보 (필수 입력) 카페 이름 스마트혼수가전-삼성,엘지,수입 카페 주소 https://cafe.naver.com/smartelectro 의류관리의 시작, 삼..."
이번주 방문고객 회원특가! 삼성에어드레서 신상품 안내드립니다,이제 소중한 옷은 삼성 #에어드레서에 맡겨주세요 #전자랜드첨단점 에서 구경하고 체험해 보세요 그리고 구입해 보세요 이번주 6일~7일 방문하시는 카페회원님들께는 인...
☆ 의류청정기 '에어드레서' 강력한 바람이 최고!!,에어드레서 강력한 바람이 위/아래에서 뿜어져 나와 옷에 묻은 먼지와 냄새를 제거 안감케어 옷걸이 사이로 침투하여 안감까지 동시에 케어가 가능한 에어드레서 의류 미...
삼성 에어드레서,엘지 스타일러랑 삼성 에어드레서중에 뭐가 더 나을까요? 방식이 다르다고 하던데 !
"삼성 미세먼지 안심가전(에어드레서,그랑데,삼성큐브) 체험단 모...","https://www.samsung.com/sec/event/homecare/?cid=kr_banner_naverr_homecare_20181023 삼성 에어드레서. 삼성 건조기 그랑데, 삼성 큐브 체험단 모집한대요~3종 모두도 가능하고 원하시는 1종도..."
삼성에어드레서 리뷰어 모집 공유해요,https://www.samsung.com/sec/event/2019_airdresser/ 전 아기 낳고도 담배 못끊는 신랑 때문에 진짜 써보고싶네요 ㅠㅠ
"삼성 의류청정기 에어드레서 화이트 (DF60N8300WG) (52,000원, 무...","상품정보 삼성 의류청정기 에어드레서 화이트 (DF60N8300WG) 52,000 원 (무료배송) 선호거래지역강남구청역판매자 신뢰별평가 0점/10점, 후기0개연락처..."
삼성 디지털프라자 본점 다녀왔어요!,했지용 :) 플래너님 통해서 2시에 예약을 걸어놓고 두시에 딱 방문했어요 ㅎ 저 자리에 옆쪽 앉아서 바로 상담시작 ㅎㅎ 제일 고민중인 에어드레서가 찍혀잇네요......
LG 스타일러 VS 삼성 에어드레서,"둘 다 써보신분, 둘 중 고민하다 사신분, 둘 중 하나 사용하고 계신분~~ 들중에 의견좀 주세요 ㅎㅎ 스타일러만 생각하고 있었는데 찾아보니 삼성것도 평이 괜찮은거 같아서 고민이 너무 되네요 ?? 회원님들..."
"삼성큐브, 그랑데, 에어드레서 미세먼지안심가전 만나볼까!!",바로 섬상 에어드레서 삼성 건조기삼성 큐브 안심가전 체험단 모집이 시작되었어요. 겉옷이 두꺼워 지는 계절이라외투 관리가 쉽지 않은데.에어드레서 하나 있으면 깔끔 ...
<전자랜드 파워센터 상무점> 삼성 의류청정기 에어드레서 예약판...,안녕하세요~ 전자랜드 파워센터 상무점 까페지기입니다맘님들이 기다리고 기다리던 삼성 의류청정기가 드뎌 출시!!그이름도 고급지다 삼성에어드레서!!!!!!!세상 가지고...
10월31일(수) 3시~5시 남산 PIKNIC에서 삼성 의류케어 제품의 사...,"10월31일(수) 3시~5시 남산 PIKNIC에서 삼성 의류청정기 에어드레서,삼성 의류건조기 그랑데,삼성 플렉스워시 세탁기 등의류케어 제품의 사용팁을 소비자 분들..."
에어드레서 스타일러 쓰시는 분들,이번에 코리아 세일 페스타하고 삼성 에어드레서 예약판매하면서 원래 LG 스타일러 사려다 고민중인데....혹시 둘다 써보신 분들 계신가요? 뭐가 좋을까요?!백색가전...
스타일러 3벌짜리도 괜찮을까요?,늘 고민만 하다 스타일러 들이기로 맘 먹었는데 삼성서 에어드레서 나와서 결제 직전 스톱 상태였어요. 사실 집에 모든 가전이 삼성이예요. (삼성 불매 하시는 분도 계시지만..) 이유는 전 삼성 서비스에...
인스타 하시는 분들 경품 도전하세요~ (에어드레서),"인스타 보다가 응모 방법이 간단해서 공유해요~ 이미지 캡쳐해서 필수 해시테그 포함 인스타에 올리면 된대요~ 저는 인스타가 비공개 계정이라 응모 못하지만, 전체공개이신분들 응모해 보시면 좋을것..."
스타일러 사신분들 만족하시나용,아무래도 스타일러나 에어드레서 둘중 하나 사야될거 같아요.. 미세먼지때매 옷을 매일 빨수도 없고.. 털어서 넣어놓긴 하는데 찝찝하고.. 에어드레서나 스타일러 사신분들 만족하시나요? 괜히 자꾸 뭘...
우리집 에어드레서요,스타일러도 좋고 에어드레서도 좋아요 우리집은 에어드레서인데요 이놈 건조기 이후 완소템 될듯요!! 냄새제거는 기가 막히게 사라지구 오래된옷 냄새뺄때 짱 좋은듯요 요...
에어드레서 개봉만한 미사용신품 팝니다,동탄역 1분거리 아파트입니다 색상은 우드 브라운인ㄱㅏ 암튼 그거구요 코드 한번 꼽아보고 옷은 안넣어봣습니다 신품이에요 와서 보시면 아시겟죠 ~ 용달은 알아서 불러...
삼성 의류청정기 에어드레서 로즈 (DF60N8500RG),"▣ 삼성, LG 가전사 기사님 방문 설치 ▣삼성 의류청정기 에어드레서 로즈 (DF60N8500RG) 모델명 : DF60N8500RG 전국 어디나 무료설치/무료배송..."
삼성 의류청정기 에어드레서 화이트 (DF60N8300WG),"▣ 삼성, LG 가전사 기사님 방문 설치 ▣삼성 의류청정기 에어드레서 화이트 (DF60N8300WG) 모델명 : DF60N8300WG 전국 어디나 무료설치/무료배..."
삼성건조기 14 에어드레서 설치했어요,삼성디지털 프라자 장림점에서 행사때 구매했어요 완전 좋네요 이불때문에 14키로 삿는데 대만족입니다 사은품도 많이받고 가격도 대만족 배송 설치까지 잘받았어요#^
"스타일러, 삼성 에어드레서, 쿠쿠정수기, 공기청정기 구매하시려...",미세 먼지 이슈로 인해 수요가 늘어난 제품들 입니다.. 그래서~ 특가 행사를 진행 해보려고 합니다. 구매 예정이신분들 계실까요?? 쪽지나 댓글 남겨주세요~^^ ***-****-****하이마트 영등점판매부장
"삼성,LG 스타일러 에어드레서 출시 최저가 렌탈 판매 무료 배송 ...","상품정보 삼성,LG 스타일러 에어드레서 출시 최저가 렌탈 판매 무료 배송 50,000 원 (무료배송) 선호거래지역부산광역시 부산진구 전포1동판매자 신뢰별평가 0점/10점..."
"신제품!! 삼성 의류청정기 ""삼성 에어드레서"" 사전예약 판매","안녕하세요~ 홈플러스 송도점 가전매장입니다 저희 삼성가전 매장에서는 삼성 의류청정기 ""삼성 에어드레서"" 사전예약 판매를 하고 있습니다 신!제!품..."
삼성 의류청정기 에어드레서 브라운 (DF60N8500BG),"▣ 삼성, LG 가전사 기사님 방문 설치 ▣삼성 의류청정기 에어드레서 브라운 (DF60N8500BG) 모델명 : DF60N8500BG 전국 어디나 무료설치/무료배..."
삼성 의류청정기 에어드레서 골드미러 (DF60N8700MG),"▣ 삼성, LG 가전사 기사님 방문 설치 ▣삼성 의류청정기 에어드레서 로즈 (DF60N8700MG) 모델명 : DF60N8700MG 전국 어디나 무료설치/무료배송..."
LG 스타일러나 삼성 에어드레서 쓰시는 분??,쓰시는 분들은 만족 하시나요? 세탁소에 맡기는 횟수도 줄었는지요? 어떤 점이 좋고 불편한지 알려주세요^^ 저희는 정장 보다는 셔츠 청바지 자켓 코트 패딩 등이 많은 편이라 어떤 제품이 더 맞을지 추천도...
전자랜드 주말장터 & 삼성건조기+에어드레서 & 딤채 김치냉장고 ...,저렴하게 건조기와 에어드레서를 구매할수 있는 기회! 2. 행사 : 건조기 + 에어드레서 패키지상품 행사 기간 : 10월 1일~31일 (10월 한달간 ) 세번째!!...
삼성 에어드레서 댓글이벤트 당첨이요,우왕^^ 무슨 댓글 이벤트에 참여했었나봐요. 이런 생각지도 못한 선물 넘좋아요ㅎㅎ 짠까페 가입하고 스벅은 내돈주고 안먹네요. ㅎㅎ 감사합니다.
"에어드레서 우드브라운새상품(대전) (1,100,000원)","상품정보 에어드레서 우드브라운새상품(대전) 1,100,000 원 선호거래지역대전광역시 유성구 원신흥동판매자 신뢰별평가 7점/10점, 후기19개연락처연락처 확인하기 번개장터에도 판매중이니..."
삼성 에어드레서 예약 마지막 혜택_9/1~9/2,삼성 의류청정기 '에어드레서' 사전판매 예약 이틀 연장되었습니다. 행사기간: ~9/2일까지 양일간 두가지 혜택 모두 받으세요 1. 공기청정기 무상증정 효과! 2....
자유부인의 날🥰,영화보는 동안 삼성 에어드레서로 외투 관리 해줬는데 뽀송하고 좋네요. 요즘 스타일러랑 에어드레서 두 개 고민중인데 결정이 어렵네요.😅 혹시 에어드레서 쓰시는 분 ...
의류건조기 삼성 에어드레서vs LG 스타일러,"개인적으로 디자인은 이번에 삼성에서 출시한 에어드레서인데, lg가 의류건조기 시장을 퍼스트무버 입장이라서 디매님들의 선택은 삼성인가요 lg인가요?"
삼성 에어드레서 스벅 기프트카드왔네요,금요일날 온다더니 방금 왔네요 정보주신 짠님 감사해요??
"에어드레서 우드브라운 새상품(대전) (1,100,000원)","상품정보 에어드레서 우드브라운 새상품(대전) 1,100,000 원 선호거래지역대전광역시 유성구 원신흥동판매자 신뢰별평가 7점/10점, 후기19개연락처연락처 확인하기 번개장터에도 판매중이니..."
★현대정수기렌탈케어★현대정수기/현대정수기렌탈/큐밍정수기/현...,"php?bo_table=sub02_06&wr_id=6&sca ? 8번.삼성 에어드레서 *골드미러/우드브라운색상 제휴카드 월 37,900원 -상세링크 http://www.hyundai-rental.co.kr/bbs/board.php?bo_table=sub02_06&wr_id=10&sca"
"내 스타일의 완성 삼성 의류관리기 에어드레서판매 (50,000원, 무...","상품정보 내 스타일의 완성 삼성 의류관리기 ""에어드레서""판매 50,000 원 (무료배송) 선호거래지역판매자 신뢰별평가 0점/10점, 후기0개연락처연락처 확인하기 번개장터에도 판매중이니..."
★★전자랜드 단 2틀 ! 삼성에어드레서 인터넷 최저가보다 싸다★...,삼성에어드레서 인터넷 최저가보다 싸다★★ ★★전자랜드 단 2틀 ! 삼성에어드레서 인터넷 최저가보다 싸다★★★★전자랜드 단 2틀 ! 삼성에어드레서 인터넷 최저가보다 싸다★★★★전자랜드 단 2틀...
에어드레서 나 스타일러 실 사용 괜찮나요~,"사용 하시는 분들~실용성 좋나요? 혹시 나중에 짐 될까봐요..출근복, 외출복 미세머리 너무 신경 쓰여서요..둘다 상담 받았는데 각자 서로 좋다고 하지요~전 스타일러가 조금 더 비싸도 맘에 드는데..실 사용..."
에어드레서,그냥 삼섬임직원몰보다 7만원싸고 상품권 5만원주길래 인터넷 검색해보니 최저가 160정도길래 ㅋ 131에 상품권5받고 구입했습니다. 정가는 207인데 ..뭐 원래 ...
에어드레서 오늘왔어요.,오자마자 입던옷 다집어넣었네요..보송보송하고 스팀으로샤워해주니 기분이 업업 되네요..
에어드레서 필터 좀 봐주세요.,외출 후 옷에 묻은 먼지 그대로 집안옷걸이에 걸어놓는게 마음에 걸려서 의류청정기 구매를 고려하고있어요. 국내 2개사 중 미세먼지필터가 달린 제품이 있는데 필터정보...
에어드레서,"개인거래(판매), 판매중, 가격 1,000,000원, 안전거래 미사용, 에어드레서, 에어드레서 실사용없음 구매가 240배송포함 100 네고불가능"
"엘지스타일러,삼성에어드레서",둘중뭐가날까요??쓰시는분계신가요~~ 사고싶은데고민중이네요 혹시저렴하게구매가능한곳아시는분계신가요?? 삼성직원할인하면싼거같던데ㅠ
삼성 에어드레서 골드미러,"개인거래(판매), 판매중, 가격 2,000원, 안전거래 미사용, 삼성 에어드레서 골드미러, 삼성 에어드레서 골드미러 판매합니다. 2월8일배송받았구요. 생각보다 별..."
에어드레서 하루 후기,어제 셔츠에다 바닐파탈뿌리고 일어나서 강력스팀(1시간50)으로 돌려봤습니다 돌리고 냄새 맡아보니까 흔적도 없이 사라졌네요 표준(39분)으로 하면 조금은 향기가 남...
스타일러 VS 에어드레서 둘중에 뭐살까요??,
에어드레서vs스타일러 어떤게 나을까요?,저희 신랑은 정장은 안입어요 미세먼지 때문에 패딩코트 애기옷들에 사용하려고 해요
동수원점 에어드레서~!! 설명회듣고 사은품 받깅!,"ㅋ 삼성가전&문화센터 콜라보에어드레서 실속구매팁! 장소 : 홈플러스 동수원점 문화센터일정 : 2018/12/7(금) 13시-14시수강료 : 1,000원내용..."
저도 세트로다가~~,"건조기, 에어드레서 신랑이 사줬어요~~~~ 그동안 고생했다고 신랑이 사줬어요~~세트로 올리려고 가스배관 이전설치도 했어요ㅠㅠ어제 수건만 돌렸는대~~ 따듯하니 좋더..."
김해 가구단지 더슬립에서 매트리스 구매했어요.,안녕하세요:) 저는 5월 진해에서 결혼예정인 예신이 입니다~ 신혼집에 세달정도 일찍 입주하게 되어서 요즘 급하게 가전가구를 알아보고 잇어용~ 가전은 삼성에서 티비...
"[공식앱] 삼성에어드레서 월 52,000원","디자인까지 꼼꼼하고 완벽하게 탄생한 삼성에어드레서. 제휴카드이용시 월최대 2만원 추가할인, 12월 설치완료시 신세계상품권 7만원 지급! 지금바로 문의주세용 ♡ ☎ 010.4398.4492 골드미러,로즈..."
"삼성 생활제품(에어드레서, 그랑데, 삼성큐브) 체험단 모집 추천","삼성전자에서 체험단을 모집하는데 꽤 좋아보이네요 제품당 10명씩이고, 3명은 3개 제품을 다 주니 확률도 나쁘지 않구, 되면 대박일듯 합니다 아직 가능하니 보시고..."
스타일러 샀어요.ㄷㄷㄷ 선배님들 답 좀 주세요^^;,역시나 오늘 롯데에 있는 하이마트 가서 에어드레서를 보고 필터와 미러 디자인에 고민하다가.. (에어드레서 미러형이 솔직히 디자인은 더 이뻤어요. 버튼도 그렇고.. 내부도 냉장고 같은 스타일러 보다 전...
"[공식앱] 삼성에어드레서 월 52,000원","디자인까지 꼼꼼하고 완벽하게 탄생한 삼성에어드레서. 제휴카드이용시 월최대 2만원 추가할인, 12월 설치완료시 신세계상품권 7만원 지급! 지금바로 문의주세용 ♡ ☎ 010.4398.4492 골드미러,로즈..."
삼성에어드레서 최고급사양 골드미러,새제품 팔아요 무료배송 가능하고요 삼성에서 직접 배달해주는 거에요 가격은 150만원이에요
삼성전자 14키로 건조기 구매시 에어드레서 초특가행사판매!!!,삼성전자 14키로 건조기 구매시 이번에 새로 출시한 에어드레서를 초특가로 드립니다. 색상 상관없이 원하는 색상을 고르세요~ 금액문의는 댓글을 남겨주시면 바로 답변...
삼성 에어드레서 완전새상품 설치기사배송,"개인거래(판매), 판매완료, 가격 1,200,000원, 안전거래(네이버페이), 삼성 에어드레서 완전새상품 설치기사배송, 삼성 에어드레서 완전새상품 기사가 방문하여..."
"[공식앱] 삼성에어드레서 월 52,000원","디자인까지 꼼꼼하고 완벽하게 탄생한 삼성에어드레서. 제휴카드이용시 월최대 2만원 추가할인, 12월 설치완료시 신세계상품권 7만원 지급! 지금바로 문의주세용 ♡ ☎ 010.4398.4492 골드미러,로즈..."
"[공식앱] 삼성에어드레서 월 52,000원","디자인까지 꼼꼼하고 완벽하게 탄생한 삼성에어드레서. 제휴카드이용시 월최대 2만원 추가할인, 12월 설치완료시 신세계상품권 7만원 지급! 지금바로 문의주세용 ♡ ☎ 010.4398.4492 골드미러,로즈..."
삼성 에어드레서 할인 바우처 판매 합니다.,"개인거래(판매), 판매중, 가격 12,345원, 안전거래 미사용, 삼성 에어드레서 할인 바우처 판매 합니다., 삼성 에어드레서 구매시 할인 바우처 입니다. (2장..."
[DF60N8700MG]삼성 의류청정기 에어드레서 할인행사중!!,감사합니다 미세먼지 필터와 탈취필터 장착으로 미세먼지와의 전투에서 승리하는 삼성 의류청정기 에어드레서가 할인행사중입니다!! 많은 문의부탁드립니다. 152만원대로 ...
드레스룸에 중문과 스타일러 위치 문의 드려요,드레스룸 외풍 막으려면 중문 외엔 방법이 없나요? 그리고 혹시 스타일러나 에어드레서 쓰시는 분 위치 어디로 두셨나요??
스타일러vs에어드레서,어떤게 더 좋을지 고민 중이에요 써보신 분들 어떠셨나요? ^^
"삼성 에어드레서 스타일러 화이트 (DF60N8300WG) (50,000원)","상품정보 삼성 에어드레서 스타일러 화이트 (DF60N8300WG) 50,000 원 선호거래지역서울역판매자 신뢰별평가 0점/10점, 후기0개연락처연락처 확인하기 번개장터에도 판매중이니..."
[홈플러스 인천논현점]삼성가전 새로운 신상탄생!에어드레서 예약...,감사합니다 안녕하세요.홈플러스 인천논현점 입니다.오늘은 특별한 삼성가전의 신상품~!!!!!에어드레서를 소개합니다.에어드레서 사전예약기간에 구매를 하시면 공기청정기...
"삼성 에어드레서 스타일러 우드로즈 (DF60N8500RG) (38,000원)","상품정보 삼성 에어드레서 스타일러 우드로즈 (DF60N8500RG) 38,000 원 선호거래지역서울역판매자 신뢰별평가 0점/10점, 후기0개연락처연락처 확인하기 번개장터에도 판매중이니..."
에어드레서 우드로즈 (DF60N8500RG) 팝니다. (미개봉새제품),"개인거래(판매), 판매중, 가격 990,000원, 안전거래 미사용, 에어드레서 우드로즈 (DF60N8500RG) 팝니다. (미개봉새제품), 에어드레서 우드로즈 (..."
에어드레서 사려는데 중고나라에서 사도 될까요?,중고나라 보니 업자들 같은데 110만원 언저리에서 살 수 있더라구요. 얼마전 백화점에선 매니저분이 자기가 깎아서 160에 주겠다고 했는데 50차이면 적은건 아니잖아요? 중고나라같은데서 사보신 분...
"삼성 에어드레서 스타일러 우드브라운 (DF60N8500BG) (38,000원)","상품정보 삼성 에어드레서 스타일러 우드브라운 (DF60N8500BG) 38,000 원 선호거래지역서울역판매자 신뢰별평가 0점/10점, 후기0개연락처연락처 확인하기 번개장터에도 판매중이니..."
에어 드레서 계약완료~~~넘 친절 감사요!,
스타일러 & 에어드레서,어느것이 더나을까요 성능 좋은걸로 사고싶네요~~~♧ 에어가 더 좋다고하는데 원조가 낫다고들하시고 알려주세요 잘모르겟어욤 ㅜ
삼성 에어드레서 뽐뿌오네요ㅜ,엘지 스타일러사고 싶은거 꾹 참고 있었는데 역시 겨울오니 뽐뿌 시작이네요ㅋ 삼성 에어드레서가 소음도 거의 없고 훨 좋다 하던데.. 큰 가전들이는건 참 고민이 많이 되요 사용하다 맘에 안들면...
스타일러나 에어드레서 보통 얼마쯤하나요?,내년에 이사앞두고 있는데 스타일러가 넘 사고싶어용. 미세먼지 때문에 나갔다오면 옷에 맨날 소독제 칙칙 뿌리고 감기잘걸리는 아가때문에 더 신경쓰이더라구요 그리고 코트 니트 패딩들도 넣어서...
「가격인하」삼성 에어드레서 DF60N8300WG 판매 합니다.,"개인거래(판매), 판매완료, 가격 900,000원, 안전거래 미사용, 「가격인하」삼성 에어드레서 DF60N8300WG 판매 합니다., 삼성 에어드레서 단순 개봉 ..."
삼성 에어드레서 (골드미러/화이트) 새제품 최저가 판매합니다.◈,"개인거래(판매), 판매중, 가격 62,000원, 안전거래(네이버페이), 삼성 에어드레서 (골드미러/화이트) 새제품 최저가 판매합니다.◈, 삼성 에어드레서 골드미러..."
삼성 에어드레서 (골드미러/화이트) 새제품 최저가 판매합니다.◈,"개인거래(판매), 판매중, 가격 62,000원, 안전거래(네이버페이), 삼성 에어드레서 (골드미러/화이트) 새제품 최저가 판매합니다.◈, 삼성 에어드레서 골드미러..."
스타일러 vs 에어드레서,둘중 뭐가 승인가요?? 스타일러나 에어드레써 잇으신분들 실구매가 어느정도 되시나요?
삼성 에어드레서 (골드미러/화이트) 새제품 최저가 판매합니다.◈,"개인거래(판매), 판매완료, 가격 62,000원, 안전거래(네이버페이), 삼성 에어드레서 (골드미러/화이트) 새제품 최저가 판매합니다.◈, 삼성 에어드레서 골드미..."
에어드레서 필요할까요??,홈쇼핑 보다 혹해서 상담신청해놨는데... 60개월 4만원정도 렌탈이고 그후로 가져도 된다네요. 미세먼지랑 웬만한거 세척되니까 드라이클리닝 어려운 옷도 대신 할수 있을거 같아서요. 어떤거 같으세요??
「가격인하」삼성 에어드레서 DF60N8300WG 판매 합니다.,"개인거래(판매), 판매완료, 가격 900,000원, 안전거래 미사용, 「가격인하」삼성 에어드레서 DF60N8300WG 판매 합니다., 삼성 에어드레서 단순 개봉 ..."
삼성 에어드레서 ..(본문추가),삼*에서 의류관리기가 나왔길래 예약구매하고 기다리고 한달전에 받았는데요 엘사꺼 안써봐서 비교가 안되네요ㅠㅠ 근데 전 옷을 넣고 돌리면 막 산뜻??? 막 개운???...
"삼성 에어드레서 스타일러 골드미러 (DF60N8700MG) (43,000원, 무...","상품정보 삼성 에어드레서 스타일러 골드미러 (DF60N8700MG) 43,000 원 (무료배송) 선호거래지역서울역판매자 신뢰별평가 0점/10점, 후기0개연락처연락처 확인하기 번개장터에도..."
삼성 에어드레서 (골드미러/화이트) 새제품 최저가 판매합니다.◈,"개인거래(판매), 판매완료, 가격 62,000원, 안전거래(네이버페이), 삼성 에어드레서 (골드미러/화이트) 새제품 최저가 판매합니다.◈, 삼성 에어드레서 골드미..."
삼성 의류관리기 에어드레서 [새제품][최저가] 판매합니다. ◆,"개인거래(판매), 판매완료, 가격 62,000원, 안전거래(네이버페이), 삼성 의류관리기 에어드레서 [새제품][최저가] 판매합니다. ◆, 삼성 에어드레서 골드미러..."
에어드레서 쓰시는 분들. 어때요?,삼성꺼로 하려는데 어떤가요?
에어드레서 안방에 넣고 쓰시는분 소음 괜찮나요,신랑 퇴근하고 와서 작동시킴 저녁인데 안방에 놓고 쓰자니 소음이 걱정되서요 실제 안방사용하신분 계실까요
