제목,내용요약
스타일러와 에어드레서,스타일러랑 에어드레서중에 뭐가 좋을까요? 써보신 분 알려주세요~
에어드레서 샀어요,오늘 에어드레서가 배송왔는데 아저씨 가시고 확인을 했네요 문열면 반대쪽 고무배킹이 잘라져 있어요 혹시 삼성에어드레서 있는분들 계시면 봐주실수 있을까요? 기분탓인진...
삼성전자-에어드레서&건조기 가전후기입니다,삼성전자- 에어드레서 후기입니다 지난번에 삼성 디지털프라자 강남본점에서 에어드레서 상담을 받았었는데요 LG스타일러와 고민을 하다가 상담해주신 내용이 만족스러워서 ...
삼성에어드레서 옷먼지제거 알아보다가~~~,"삼성에어드레서 미세먼지 필터,냄새분해 필터가 있네요~~호흡기가 약한 남편이라 오래전부터 집안 공기 관리에 신경을 써왔는데요~외출하고 들어올때 옷에 묻은 미세먼지도..."
솔옴 &에어드레서 착샷없는 후기,에어드레서 스타일러의 흔들어주는거나 에어드레서 바람불어주는거나 효과는 그게그거라 생각이 들어 고민을 엄청 했는데 결국 사용목적은 탈취 및 주름제거라 구매를 위해 ...
에어드레서 한달 후기입니다!,"멋쟁이 회원님들 보면서 하나하나 모으는 재미에 살고 있습니다 ㅎㅎ 이전에 에어드레서 구매했는데, 생각보다 후기를 궁금해 하시는 분들이 몇몇 계셔서 짧고, 무성의 ..."
에어드레서vs스타일러,에어드레서를 구입예정이에요. 처음에는 엘지 스타일러를 봤는데 삼성 에어드레서가 좋다는 주변 의견도 있어서 고민이 되네요. 스타일러는 흔들어서 먼지를 떨어트리는 방식이고 에어드레서는 위에서...
그랑데 건조기 및 에어드레서 후기(단점위주),엘지 스타일러랑 에어드레서 고민하다 에어드레서랑 건조기 같이 구매했네요. 실사용해보니 장단이 있는거 같아용. 일단 삼성건조기 그랑데는 먼지거름망이 좀 약해여 아물틀이는 접히는 부분이 약해서 잘...
에어드레서 쓰시는분 계세요?,스타일러랑 에어드레서 고민하다가요 소음이랑 탈취쪽이 에어드레서가 낫데서 사려는데 스타일러보다 훨 비싸네요.. 매장에서 카드할인혜택 다 넣어서 150에 가능하댔는데 스타일러는 인터넷에서...
스타일러or에어드레서,스타일러 or 에어드레서 사용하시는분들 장단점좀알려주세요~^^ 일단 에어드레서는 미세먼지필터가 있어서 더 끌리는데ㅜㅜ 원래 가전은 LG다해서 스타일러 무조건사자! 였는데 에어드레서가 후반에...
삼성에어드레서 리뷰어 모집해요~,삼성 에어드레서 의류청정기 리뷰어 총 10명을 2회에 걸쳐 각 5명씩 모집한다고 해요~ 몇 달전부터 여러 차례 체험단 모집 했었는데 반응도 좋고 디자인도 예뻐서 ...
"삼성에어드레서 필요해서 찾다보니 이것도 같이 겟,",삼성에어드레서 구매하려고 알아봤어요.처음에는 저게 왜 필요할까 했는데 이제는 정말 절실해졌거든요ㅠ그런데 알아보다가 보니까 이것도 맘에 들어서 결국 같이 사게 되었...
에어드레서 왔어용,에어드레서 왔어요 ㅋ 너무 좋아용 이제 옷에뭍은 미세먼지 남편 담배냄새 제거할수 있겠네요 ㅋ 소음도 없고 괜찮네요
원룸) 에어드레서vs큐브(공청기),뭐살까요?? 가격은 에어드레서가 30정도 더 비싸네요 원룸이라 나중에 이사가면 에어드레서는 이사 힘들것 같은데 사고 싶긴하구요..
삼성 에어드레서 무슨 색상이 괜찮을까요~?,ㅎㅎㅎ 저희 집에 에어드레서 들이면 둘 곳이 침실 옷장 옆 뿐이라서소음이 적은걸로 사려고 찾아보고있었거든요~~ 보니까 삼성이 소음이 적다고 그러고 어떤분은 아이들...
스타일러 에어드레서... 사용해보신 분~,스타일러 나 에어드레서사용 중이신 분 중 아파트 사시는 분은 어떠셨나요? 층간소음 이나 그 밖에 불편한점은 앖으셨는지요? 지혜로운 송파맘 님들의 조언 부탁드립니다. 이사도하려니 현실적인 여러...
삼성 에어드레서 써보신분 계세요?,더군다나 패딩이나 겨울 외투는 매번 빨기도 자주 드라이클리닝 맡기기도 번거롭기 때문에 ㅠㅠ~ 엄청 고민중이다가 티비 광고로 삼성 에어드레서를 봤어요. 첫 번째로는...
요 삼성 에어드레서,요즘 에어드레서 같은거 쓰는집이 많길래 뭔가 싶어서 물어봤더니 겨울 외투는 매번 입고 나서 드라이 맡기기도 번거롭고 털어도 다 털리는게 아니니까 미세먼지랑 탈취랑...
에어드레서 vs 스타일러,삼성 에어드레서와 엘지 스타일러.. 어떤거 들이고 싶으세요? ☆무선청소기 삼성 건과 엘지 코드제로 비교하다 삼성건 사서 후회중인 사람입니다.☆ ☆이번엔 진짜 신중하게 사려구요☆
삼성 에어드레서 눈 도장 찍어두신분~,제 얘기였거든요 삼성 에어드레서 광고 보자마자 너무 한 눈에 반해서.. 너무 예쁘게 생겼어요 ㅠㅠㅠ 아니 예쁘게 생긴건 둘째치고 겨울 외투.. 특히 패딩은 입고 ...
에어드레서 또는 스타일러쓰시는분..,에어드레서랑 스타일러 쓰시는 분들.. 장점과 제품 소개 좀 부탁드려요~ 남편이 갑자기 스타일러를 사자고 하는데... 뭐가 좋은지도 모르겠고.. 쓰시는분들 실용적인가요? 어디 제품 쓰시나요? 참고로 용량이...
[공유] 삼성 에어드레서 체험단 신청중 이라네요~!,위 내용은 확인 후 삭제하시고 글을 등록해주세요 * 광고 아닌 제 손품 팔아 저도 신청해보는 추천 공유글 입니다 (-_-) * 삼성 에어드레서 리뷰어 모집 (~2/20) 1차 : 1월 23일 ~ 2월 10일 까지2차 : 2월 11일 ~ 2월...
스타일러 vs 에어드레서,엘지 스타일러 (먼지를 흔들어서 터는 방식) 삼성 에어드레서 (바람을 위에서 쐬어 먼지를 떨어트리는 방식) 중에 고민중이예요. ㅠ 어떤걸로 구입하는게 좋을까요? :)
삼성에어드레서,"삼성에어드레서 괜찮나요? 기다렸다가 2세대 나오면 살까 하는데, 요즘 너무 사고 싶네요."
[삼성 에어드레서 리뷰어 모집 이벤트] 진정한 의류 청정을 위한...,[삼성 에어드레서 리뷰어 모집 이벤트] 진정한 의류 청정을 위한 '삼성 에어드레서' 리뷰어 모집 소식을 널리 알려주세요!(~2.17까지/신세계상품권 10만원권 5...
엘지 스타일러 vs 삼성 에어드레서,엘지 스타일러 vs 삼성 에어드레서 회원님들 중에 두 제품 모두 써본신 분들있으신가요? 둘중에 하나 구입하려하는데 어떤게 좋을까요 저는 둘다 사용 못해봐서 사용하고 계신 분들의 평가가 궁금합니다
에어드레서?? 스타일러 ??,혹시 삼성 에어드레서나 엘지 스타일러 사용하시는 분 있나요?? 어떤지 넘 궁금하네요 건조기랑 별도로 이것도 있으면 생활이 편리해지나요?? 찾아보니깐 니트류나 겨울 코트 드라이크리닝 대신 이걸루...
"에어드레서, 스타일러 쓰시는분들 만족하세요?",그리고 상의 5개 들어가는거랑 3개 들어가는 두 가지 모델이 있던데(스타일러기준) 어떤게 나을까요? 또 스타일러 할지 에어드레서 할지도 고민이에요. 쓰시는 분들 체험담 듣고 싶어요. 조언 부탁드려요.
삼성건조기/에어드레서 vs 엘지건조기/스타일러,"엘지 스타일러는 좌우흔들림으로 옷감을 터는 방식이라 진동에 의한 소음이 발생하는 반면, 삼성 에어드레서는 옷 내부에 바람을 불어넣어 소음이 없다는 점 몇몇 의견이 삼성 건조기와 삼성 에어드레서를..."
스타일러 vs 에어드레서,의류 관리기를 사려고 하는데요~ 스타일러랑 에어드레서 중에 고민이예요~ 어차피 둘 다 비싼 거 가격보다는 기능이 제대로 인 걸 사고 싶은데 뭐가 좋을 까요? 알아볼수록 미궁에 빠지는 느낌입니다ㅜ...
에어드레서 사용 좋은가요,페브리즈만 몇년 사용중인데 에어드레서 있으면 편한가요? 요즘은 세탁기도 코스가 좋아서 돌리고 건조기 돌리면 뽀송 하던데 울종류는 답이 없어서요
에어드레서 써보신 분 계신가요?,먼지에 엄청 민감한데 미세먼지가 심한 날이면 세탁기 건조기 돌려도 너무 불안하더라구요이참에 스팀기 하나 장만하려다가 삼성 에어드레서 광고를 봤는데 너무 위시템이 ...
에어드레서 구매 해보신 분 계신가요?,요즘 제일 고민하고 있는 것 중 하나인데요~ 에어드레서가 있으면 확실히 의류 관리하는 데 다르다고 해서요 드레스룸에 들어갈만한 공간은 딱 있고 저는 사고 싶다는 ...
스타일러 VS 에어드레서,"3벌 들어가는 작은 사이즈로 렌탈 할껀데 엘지스타일러와 삼성에어드레서중에 어떤게 더 나을까요? ★ 잠깐! 게시글 작성 전, 필독 공지! ★- 카페규정 : http://cafe.naver.com..."
에어드레서 쓰시는 분ㅠㅠ,"글에 앞서 먼저, 다들 새해 복 많이 받으시고 좋은 일 가득하시길 바랍니다. 최근 제 관심사는 에어드레서입니다. 이 것이 과연 고양이털을 잘 제거해주는지와 진동과..."
드뎌! 에어드레서 질렀어요 ㅎㅎ^^,※삭제하지 마시고 남겨주세요^^ 간만이네요 ^^ 집에 에어드레서를 들이기로 결정했어요 결제하고 왔는데 너무 신나는거 있죠 에어드레서 광고 처음에 보고 너무 갖고싶...
에어드레서 들였어요^^,"슬금슬금 스타일러,에어드레서에 뽐뿌가 오더라구요 스타일러 살까, 에어드레서 살까 고민하다가 에어드레서로 낙찰! 남편이 곧바로 허락해 줘서 룰루랄라 샀어요 오자마자..."
"에어드레서, 스타일러 둘 중 고민인데요,",두 개 다 써보신 분은 없을 것 같은데 에어드레서는 진솔한 후기가 별로 없어서요. ㅎㅎㅎ 저희집은 정장이나 양복은 어쩌다 한번이고 외투와 니트류가 대부분인데 흔들리는 것과 바람 차이 모르겠어요..........
혹시 lg 스타일러나 삼성 에어드레서 사용하시는 분들 계신가요,스트릿 의류 특성상 여러 번 세탁을 하면 물도 빠지고 소재도 거칠어지는데 스타일러나 에어드레서 사용하면 그냥 해결... 기능성 모드도 따로 있고 강력세탁도 있어서 그냥 대박입니다 ㅠㅠ... [※글 작성시...
삼성에어드레서 체험단 같이 해요!,#진정한의류청정 #삼성에어드레서 #미세먼지필수템 #인테리어가전 에어드레서 두고 싶은 곳 촬영해서 응모하면 끝이에요 ! 체험단 끝나고 미션 클리어 하면 에어드레서 ...
스타일러? 에어드레서? 추천해주세요,엘지가 먼저 스타일러를.출시하긴했는데 삼성도 에어드레서가있더라구요 추천 부탁드려요 ^
삼성 에어드레서 리뷰어 모집한데요~,이젠 삼성에서 이런것도 네이버 광고로 홍보하네요~에어드레서 리뷰어 모집한다구요~그래서 저도 살포시 참여해봅니다~ 아래는 신청 url이에요~https://www.s...
#삼성에어드레서 사고싶네요,옷장도 맞췄는데 에어 드레서가 눈에 보이네요 삼성 에어 드레서 들이면 딱 좋은 자리인데.. 서랍장 옆에 놓고 싶네요^^ 집에 두면 좋겠죠?? #삼성에어드레서 #미...
삼성 에어드레서 할인 정보에요 ^^~,요새 에어드레서 광고하는거 보고 깜짝 놀랬네요 저런것도 생겼나.. 하긴 매번 드라이보내는 것도 지치고 패딩은 입고나서 늘 밖에서 털면서 탈취제 뿌리기 바빳는데 그...
삼성 에어드레서 할인코드있네요,이번에 에어드레서 살려고 찾아보고있는데 너무 비싸더라구요... 근데 너무 기능은 최고고 이제 가정마다 필수품정도 아닐까싶을정도로 매일 정장입고 출근하는 남편한테도...
에어드레서 쓰시는분 계신가용?,오늘 에어드레서 결재하구 왔는데요 사용하시는분 만족하시는지 궁금해서요 친구는 스타일러 쓰는데 완전 강추하더라구요 스타일러플러스라고 엄청큰사이즈도 나왔더라구요 미러...
CJ샵에서 삼성에어드레서 렌탈해서 미세먼지에서 빠져나왔어요!,미세먼지를 안고 오는 겉옷 세탁을 위해 삼성에어드레서를 들였죠. 그리고 가전제품 렌탈 특가 공식 CJ헬로렌탈샵 CJ샵에서 진행하니까 제휴카드할인으로 시중보다 저렴...
삼성에어드레서 갖고싶네요~^^,삼성 에어드레서가 요즘 눈에 띠네요~~저기 거실 한 켠에 놓고 싶네요~~ 에어드레서 쓰시는 분 있으신가요~?
삼성 에어드레서 리뷰어 모집한데요~,삼성 에어드레서 리뷰어 모집합니다 https://www.samsung.com/sec/event/2019_airdresser/?cid=sec_banner_naver...
에어드레서에 한복 돌려보신 분~,아기 한복 급히 입을 일이 있는데 버릴려고 방치해 뒀던거라 한 번 돌리고 싶은데 에어드레서 해보신 분 계신가요? 실크코스로 할까 생각중입니다 ㅎ
에어드레서 샀어요 ㅎㅎ~~~,했는데 스팀기는 실용성이 없을 것 같아서 걱정하고 있던차에 삼성 에어드레서를 찾았어요 ㅠ 광고 요즘 엄청했는데 저는 저번주에 동네 엄마가 추천해서 처음 알았네요~...
"에어드레서..(스타일러, 로 잘 알려진..) 좋네요",삼@에서 나온 에어드레서~ (엘@에서는 스타일러라고 하죠) 생각보다 커서 공간 차지하는건 좀 글킨한데 (짐 늘어나는거 싫어서 여태 망설였거든요) 물빨래 매일 세탁...
삼성 에어드레서 리뷰어 모집한데요~,이런글 올렸다고 강퇴시키면 안되요~저도 에어드레서 가지고 싶어서요 ㅜㅜ https://www.samsung.com/sec/event/2019_airdresser/...
삼성 에어드레서 할인 프로모션 진행하네요~~,아가들 때문에 너무 고민중인데 겨울 외투같은건 입자마자 드라이를 보낼 수도 없는데 미세먼지 심한날은 점점 더 많아지고걱정이 늘던차에 에어드레서 있으면 잘 쓴다는 ...
에어드레서나 스타일러 쓰고계시는분들 계신가요..질문쫌,에어드레서 이제 한달가량 사용중인데 이거 원래 옷에 묻은 먼지나 머리카락은 제거가 안되는건가요? 코트넣어놔도..뽀송해지긴하는데 먼지나 얼룩같은건 그대론데 원래 그런건가요
에어드레서 와 스타일러 중 고민이라서요,스타일러 5벌짜리랑 에어드레서 고민중이요 매장은 안가봤는데 사용후기좀 알려주세요
"Lg 스타일러, 삼성 에어드레서 쓰시는맘님들 어떤가요??","스타일러나 에어드레서 중 하나 살까하는데 쓰시는분들 어떤가요?? 장,단점 있으면 마구마구 알려주심 감사하겠슙니다 ❤️"
할인 코드 떴어요 ~ 삼성 에어드레서^^,회원님들 게시글에 무분별한 답글홍보는 수시로 카페운영진이 검색후 모든글 삭제 및 영구강퇴됩니다(글쓰기 공지 확인하신후 글작성해주세요) 전 에어드레서라는걸 얼마전에...
삼성에어드레서 골드미러 미개봉,"개인거래(판매), 판매중, 가격 1,300,000원, 안전거래 미사용, 삼성에어드레서 골드미러 미개봉, 삼성에어드레서골드미러 미개봉 서울지역 사진출처는 네이버 미..."
삼성 에어드레서 체험단모집하더라구요,"삼성 에어드레서 체험단모집하더라구요 1차 , 2차 구분되어있고 1차는 이미종료되었으니 2차 노려보세요. 저도 안하던 인스타해보렵니다.ㅋㅋ https://www.samsung.com/sec/event/2019..."
스타일러VS 에어드레서,저는 칼주름기능 필요없으니 삼성에어드레서가 나을까요? 드레스룸은 이미 터져나갈듯 꽉차서 안방에 둬야하는디.. 밑에글 보니 소음이 좀 있는듯하고..둘중 소음은 그나마 어떤게 약할까요? 아니 근데.. 저...
[공유] 삼성 에어드레서 할인 정보 공유해드려요~~,요즘 광고 많이하더라구요 비염도 심하고 미세먼지 심한날은 외투도 찝찝해서 버거웠는데 에어드레서라는게 따로 있더라구요 미세먼지 너무 심하면 세탁기 돌리고 건조기 돌...
에어드레서 써보신 분 계신가요~,결국 불신에 걸려서 다른거 없나 싶어서 보는데 에어드레서를 찾았어요 에어드레서 요즘 광고 엄청 해서 얼결에 보는데 너무 갖고싶더라구요. 회식 많은 남편 셔츠랑 겨...
#삼성에어드레서 체험단에 신청하세요~~~,#진정한의류청정 #미세먼지필수템 #인테리어가전 #삼성에어드레서 체험단을 모집하네요~~~ 맘님들도 신청하셔서 체험단이 되어 보시길 바립니다~~~~ 저희집은 여기에 ...
스타일러:에어드레서?,차이점이먼가요 에어드레서가더좋은건가요 스팀건조 드라이 까지되던데 어떤게더좋아요 좋은게 천지네요 근데 종류가많고 브랜드선택도 어렵고 요새패딩 입고 드라이 하는데 사고싶어요 추천해주세요
삼성 에어드레서 쇼핑후기및 사용후기,열심히 검색해서 얻은결과 스타일러보다는 에어드레서로 갔습니다 정장을 잘안입어서 그런지몰라도 스타일러의 바지칼주름은 매리트가없었고 바닥에 먼지쌓인거 치워줘야하고 등...
삼성 에어드레서 리뷰어 모집한대요~~,"공기청정기, 강제환기, 전열교환기 ,미세먼지 측정기..등등 최대한 미세먼지는 피해보자 싶어서 구입한것들인데 아직 스타일러는 고민이였거든요 이번에 삼성에서 나온 에어드레서 리뷰어..."
삼성 에어드레서 샀어요~,스타일러와 고민 끝에 삼성 에어드레서 구매했어요 옷장에 입었던 옷도 같이 걸고 문 닫아 두니까 외부 냄새랑 묶은 냄새도 나는것 같아서 옷 관리 때문에 너무 스트레...
의류관리기는 에어드레서가 좋네요!,"담주 남편 생일선물로 어머님께서 스타일러 사주신다고 하시길래 냉큼 백화점 갔다왔어요 ㅎㅎㅎ LG에서 의류관리기를 처음 출시하기도 했고 유명하지만, 이번에 삼성에서도 에어드레서가 나와서 후회없는..."
에어드레서,에어드레서 가성비어떤가요?
삼성 에어드레서 vs lg 스타일러,"그런데, 요즘 미세먼지도 심해서 에어드레서나 스타일러도 있으면 좋다고 하더라고요~ 그래서 엘지와 삼성 중에 고민입니다. 그리고 방에 전신거울을 놓는 것보다 요새 전면 거울 방식으로 된 에어드레서..."
에어드레서나 스타일러요~,세탁소 매번 왔다갔다 귀찮은데 스타일러는 소음과 진동이 심하다는 평이 있고 에어드레서는 후발주자인데 비싸네요 겨울코트나 니트류에 좋을까요? 주름 펴준다는건 기대도 안하지만요 ^^; 냄새나 먼지털이...
스타일러나 에어드레서 쓰시는분 어떠신가요?,스타일러나 에어드레서 쓰시는분 어떠신가요?
삼성전자 인버터 히트펌프 에어드레서 DF60N8500BG 우드 브라운(...,"개인거래(판매), 판매완료, 가격 1,300,000원, 안전거래 미사용, 삼성전자 인버터 히트펌프 에어드레서 DF60N8500BG 우드 브라운(새상품), 삼성전자..."
삼성에어드레서 우드로즈 제품렌탈,삼성에어드레서 우드로즈 제품렌탈 안녕하세요? 오군가전렌탈샵 입니다. 최근 의류관리기 정말 인기가 높아지고 있는데요환경적인 요인인 미세먼지 문제 뿐만 아니라 옷에 ...
에어드레서 입성!,"정말 벼르고 별러서 구매한 삼성 에어드레서입니다. 삼성닷컴이벤트도 도전해보고, 엘지 상품평 이벤트도 도전해보면서 기대를 했었는데, 역시나 저는 안되더군요. 제돈으..."
LG 스타일러 vs 삼성 에어드레서,아 머리 터지겠어요~~~~~ ㅠㅠ 당근 엘지 스타일러로 사려고 하고있었는데 삼성에서도 에어드레서라고 나왔더라고요...? 일단 주말에 백화점서 행사중이라 엘지 건조...
스타일러??에어드레서??님들의 선택은요??,스타일러 사고싶어 째려만보다 사려고 맘먹었는데 삼성에서 에어드레서가 나왔네요! Lg 는 흔들어서 먼지터는 방식이라하고.. 삼성은 바람으로 먼지 털어준다고 하는데... 뭘 사시겠어요?? ㅎㅎㅎ
삼성 에어드레서(스타일러) 쓰시는 분 계세요?,스타일러 사려고 알아봤더니 삼성에서 나온 에어드레서가 있네요. 하이마트가서 두 가지 다 보고나니 에어드레서가 더 끌리더라구요. 제트에어로 강하게 바람쐬서 안감까지 털어준단게 맘에 들더라구요....
"[공식앱][삼성 에어드레서 골드미러 특가][41,000원]","+가격 : 41,000 원 +상품 : 삼성 에어드레서 골드미러 특가 +상태 : #미개봉 #한정판 #무료배송 부담없는가격, 안심할수있는 36개월약정및 무상 AS 보장. 2월특가 ! 바로 구매할 타이밍입니다. 기간한정상품..."
☆리뷰어 모집☆ㅡ이것이 진정한 의류청정 삼성 에어드레서 리뷰...,등산복 관리도 어렵고세탁소 맡기는 비용도 만만치 않죠 이럴때 삼성 에어드레서가 필요합니다. 유명 패션모델 김원중. 탤런트 윤승아.유튜버 라뮤끄등이 사용 검증해주신...
삼* 에어드레서 사용해 보신 분 계시나요?,엘*스타일러는 소음있다고해서 삼*에어드레서로 살까하는데요.. 머리카락 같은건 잘 안 떼진다는 얘기도 있는것 같아.. 실제 사용하신 분들 사용후기 부탁드려요~ 건조기 구입할때도 엄청 고민하다 엘*로...
삼성에어드레서 렌탈 케어 청정 탈취 한번에,아는 언니네 밥먹으러 갔다가 스타일러를 보게 되었어요 오 이게 말로만듣던 근데 언니는 요즘 가장최신에 나온 삼성에어드레서 렌탈 할걸그랬다며 뭣보다 디자인과 색상에...
"삼성 에어드레서 골드미러 새상품 110만. 박스없음,배송비별도","개인거래(판매), 판매완료, 가격 1,100,000원, 안전거래 미사용, 삼성 에어드레서 골드미러 새상품 110만. 박스없음,배송비별도, 삼성에어드레서 골드미러 ..."
"[공식앱][삼성 에어드레서 골드미러 특가!][41,000원]","+가격 : 41,000 원 +상품 : 삼성 에어드레서 골드미러 특가! +상태 : #미개봉 #한정판 #배송비있음 부담없는가격, 안심할수있는 36개월약정및 무상 AS 보장. 2.월특가 ! 바로 구매할 타이밍입니다...."
스타일러 or 에어드레서 뭐가 나을까요?,스타일러랑 에어드레서 고민이에요 찾아보니 두개 다른게 털어주는 기능 헤파필터 제습 (문열고 / 닫고 차이) 3벌 5벌 금액 이 정도인거같은데 건조기가 있어서 털어주는거나 이불 또는 큰 옷은 크게 문제...
삼성에어드레서,쓰시는분계신가요? 스타일러사러갔다가ㅡ에어드레서추천받아고민이네요ㅡ삼성.LG장단점알고싶네용 정보부탁드려요^^
열일중인 에어드레서,요즘 미세먼지때문에 열일중인 저의 최애 가전 에어드레서입니당 아기잘때 인형 살균하고있어요!!
2018 삼성 의류청정기 에어드레서 영상 감상 이벤트,<2018 삼성 의류청정기 에어드레서 영상 감상 이벤트> “삼성 에어드레서가 좋은 이유!”4단계 의류 청정으로 더 깨끗하게 관리!새로운 바람과 스팀의 ...
☆리뷰어 모집☆ㅡ이것이 진정한 의류청정 삼성 에어드레서 리뷰...,등산복 관리도 어렵고세탁소 맡기는 비용도 만만치 않죠 이럴때 삼성 에어드레서가 필요합니다. 유명 패션모델 김원중. 텔렌트 윤승아.유튜버 라뮤끄등이 사용 검증해주신...
☆리뷰어 모집☆ㅡ이것이 진정한 의류청정 삼성 에어드레서 리뷰...,등산복 관리도 어렵고세탁소 맡기는 비용도 만만치 않죠 이럴때 삼성 에어드레서가 필요합니다. 유명 패션모델 김원중. 탤런트 윤승아.유튜버 라뮤끄등이 사용 검증해주신...
삼성에어드레서,쓰시는분계신가요? 스타일러사러갔다가ㅡ에어드레서추천받아고민이네요ㅡ삼성.LG장단점알고싶네용 정보부탁드려요^^
열일중인 에어드레서,요즘 미세먼지때문에 열일중인 저의 최애 가전 에어드레서입니당 아기잘때 인형 살균하고있어요!!
2018 삼성 의류청정기 에어드레서 영상 감상 이벤트,<2018 삼성 의류청정기 에어드레서 영상 감상 이벤트> “삼성 에어드레서가 좋은 이유!”4단계 의류 청정으로 더 깨끗하게 관리!새로운 바람과 스팀의 ...
☆리뷰어 모집☆ㅡ이것이 진정한 의류청정 삼성 에어드레서 리뷰...,등산복 관리도 어렵고세탁소 맡기는 비용도 만만치 않죠 이럴때 삼성 에어드레서가 필요합니다. 유명 패션모델 김원중. 탤런트 윤승아.유튜버 라뮤끄등이 사용 검증해주신...
