제목,내용요약
"루헨스정수기,공기청정기(케어포함)(23,900원) 외 4개 상품","루헨스정수기,공기청정기(케어포함)23,900 원 (무료배송) 상품확인하기 http://m.bunjang.co.kr/products/94374574에어드레서+건조기..."
"염창동 오피스텔, 등촌동 오피스텔 한번 알아보세요!","옵션은 풀옵션으로 천장형 에어컨2대, 양문형 냉장고, 드럼세탁기인덕션, 에어드레서, 전자렌지 등이 있고주방가구는 한샘 주방가구로 입주자를 배려한 깔끔한 모습입니다..."
삼성에어드레서 우드브라운 오군가전렌탈샵,삼성에어드레서 우드브라운 오군가전렌탈샵 안녕하세요? 오군가전렌탈샵 입니다. 요즘 방송CF에서 삼성에어드레서 많이 보게되는데요 최근 다양한 의류관리기가 등장하고 있...
"졸업_입학선물은 가자,전자랜드양주점! [구정맞이노트9,8특가 SA...",*삼성에어드레서 제트에어로 겉과속을 확실하게 털어내고 필터로 털어낸 먼지&냄새 제거까지 ♥ ◆김치냉장고/S/A/L/E◆ㅡ 오리지널 땅속냉각+독립냉각 한겨울...
롯데에서 문자 왔군요,"경품 페스티벌 [1.4(금)~1.13(일), 5층 사은행사장] - 경품내용 : 삼성 에어드레서, LG 트롬건조기, LG 공기청정기 外 2019개의 HOT TREND 상품 - 대상 : L.POINT카드 소지고객 Event2. 인기가수 릴레이 콘서트..."
"주방용 코브라수전1,롱코브라1 미사용 새제품 수원(25,000원) 외...","주방용 코브라수전1,롱코브라1 미사용 새제품 수원25,000 원 상품확인하기 http://m.bunjang.co.kr/products/95966389삼성 에어드레..."
삼성 의류관리기 에어드레서 골드미러 기간한정 특가상품!(인터넷...,"삼성 의류관리기 에어드레서 골드미러 DF60N8700MG의무 사용기간 : 36개월월 렌탈료 : 4,1000원제휴카드 이용시 월 : 21,000원기간한정 특가상품! ☆☆☆신속하고 친절한상담☆☆☆ ***-****-****..."
설정샷 ㅋ,설정샷 ㅋㅋㅋㅋㅋㅋㅋㅋ 이예요!!! 집에 에어드레서 새로 들이고 ㅋㅋㅋ 인스타용으로 자랑샷 하나 찍어봤어요 ㅋㅋㅋ 신세계네여! ㅋㅋㅋㅋ
삼성전자 에어드레서 DF60N8700MG,"개인거래(판매), 판매완료, 가격 1,400,000원, 안전거래(네이버페이), 삼성전자 에어드레서 DF60N8700MG, 새제품입니다. 사용할 형편이 아니라 바로..."
[하이마트세종점]전국 최저가 도전!!!!,(모든 냉장고 전국 최저가 보장) 화제의 상품 스타일러 에어드레서 최저가를 보장합니다! (역대최저가 도전!) LG OLED 65' TV(역대 최저가 가격파괴!) ...
건조기 구매 예정이신분이요~,"저는 이사 예정이라 새로 들어가는 집에 건조기 구매하려고 백화점, 대리점, 대형마트 다 돌아다니면서 견적 받아본 결과 이** 트*이더스가 가장 저렴해서 어제 질렀네요ㅎ 에어드레서도 함께......;; 혹시..."
강남찍고 집에서 새우장 먹방하려고요,오랜만에 친구랑 강남 놀러갔는데 양대창 집에 에어드레서가 있더라구요 ㅋㅋㅋ 심지어 15대 넘는 것 같아요 역시 강남은 달라도 다른가봐요 친구랑 스타벅스 가서 저금...
(대전충청 서산지역)12월 할인 질문좀 드려도될까요..?,그리고 저 에어드레서 안 받고 90만원 할인받고 연식보상까지 중복가능한건가요 세이브오토까지 적용한다면 혹시 다 해서 몇만원 할인되는디 알려주시면 감사하겠습니다 ㅠ...
[일부하자제품] 삼성 에어드레서 판매합니다. 판매가 80만원. 인...,"개인거래(판매), 판매완료, 가격 800,000원, 안전거래 미사용, [일부하자제품] 삼성 에어드레서 판매합니다. 판매가 80만원. 인터넷 최저가 155만원, 해..."
삼성에어드레서 화이트 특판,"개인거래(판매), 판매중, 가격 1,050,000원, 안전거래 미사용, 삼성에어드레서 화이트 특판, 삼성에어드레서 판매합니다 메탈미러 색상으로 가장 인기있는 컬러..."
삼성 에어드레서 미개봉 새제품 DF60N8500BG,"개인거래(판매), 판매중, 가격 1,000,000원, 안전거래 미사용, 삼성 에어드레서 미개봉 새제품 DF60N8500BG, 삼성에어드레서DF60N8500BG 박..."
스타일러 좋은가요?,요즘은 삼성 에어드레서도 나오던데 그만큼 수요가 있단거겠죠? 코트나 모피 무스탕 가죽 등도 냄새제거 괜찮을려나요?
"[CJ임직원 특가] 삼성 노트북, 에어드레서, 아이패드, UHD TV 최...","- 전제품 인터넷 최저가!- 36개월 무이자 할부에 36개월 AS지원까지- 제휴카드 사용 시 36개월 간 월 17,000원(총 612,000원) 추가 할인 - 2월 11일까지만 해당가격에 가능합니다 상담..."
[행사종료] 삼성 에어드레서 사전판매 / 8월21일~8월31일,
삼x vs 엘x 의류,스타일러 쓰시는분들 계신가요. 스타일러.에어드레서중에 어떤거추천 하시나요? 구매하려는데ㅠ결정장애가ㅠ
가전 견적 잘 받은걸까요?!,냉장고 - 삼성 패밀리허브 4도어 RF85N9752G1B 세탁기 - 삼성 드럼 21kg WF21N8750TV 건조기 - 삼성 16kg DV16R8540KV 에어드레서 - 삼성(우드브라운컬러) DF60N8500BG 에어컨 -LG 스탠드(2 in 1) FQ17V8KWB2....
라티시마원 디스케일링!!,20분정도 걸린다고 하네요 ㅜㅜ ㅎㅎ아침 모닝커피가 이렇게 날아갑니당 흑 ㅜㅜ 아그리구 요건 자랑샷!!ㅋㅋㅋ 어제 에어드레서 질렀어요 ㅎㅎ 원래는 신랑 과장진급 ...
삼성 에어드레서 (DF60N8300WG) 팝니다,"개인거래(판매), 판매중, 가격 1,300,000원, 안전거래 미사용, 삼성 에어드레서 (DF60N8300WG) 팝니다, 이번에 이사가면서 인테리어를 하는데 사은..."
와이프가 스타일러에 꼿혔습니다.,으음....아니 근데 이 스타일러나 에어드레서 실제로 쓰는 분들 있으신가요? 이게 진짜 광고마냥 옷도 펴주고 패딩도 깨끗하고 빵빵 해지고 그러나요? 와이프가 블로...
지구 트렌드트럭 천만원 경품이용!,"에어팟, 에어드레서, 막스마라코트, 몽클레어패딩, 입생로랑클러치, 버버리캡.....엄청 많은데 5개 고르느가 힘들었습니다...ㅋㅋㅋ 이벤트 공유인증하면 천명한테스..."
11/13 점심 시황 (전저점 붕괴 or 쌍바닥패턴),며칠전부터 스타일러나 에어드레서 중 무엇을 살까 고민 고민하다가 에어드레서를 샀습니다. 오늘 배송와서 처음 돌려보는 중입니다. 세탁소 드라이크리닝을 자주 이용하는데 에어드레서로 세탁비가...
#진정한의류청정 #삼성에어드레서 #미세먼지필수템 #인테리어가전,#진정한의류청정 #삼성에어드레서 #미세먼지필수템 #인테리어가전
★현대정수기렌탈케어★현대정수기/현대정수기렌탈/큐밍정수기/현...,"삼성/에어드레서/삼성세탁기, ★ 고객만족도 우수기업 현대렌탈케어 2019 렌탈 EVENT ★ ◈ 현대랜탈케어 2019년 2월 렌탈 프로모션 ◈ - 제휴카드 최고 ..."
삼성 에어드레서,쓰시는분 계시나요 조아보이네요잉 실생활에서 얼마나유용할지...궁금네요 사고싶네용ㅜ.ㅜ ㅋㅋㅋ
삼성에어드레서 우드브라운렌탈,삼성에어드레서 우드브라운렌탈 안녕하세요? 오군가전렌탈샵 입니다.요즘 티비광고 보다보면 삼성에어드레서 많이 보게 되는데요 깨끗한 옷 관리할 수 있어 정말 욕심나는 ...
"위메프 종근당 전제품 30,611원/무배에 추가할인에 두바이,삼성전...","삼성제품에어드레서, 냉장고, 티비, 노트북이 있어서이 중 하나만 당첨되도 넘 좋을 것 같아요 ㅋㅋㅋ 단가 낮은것도 있는데 그거 구입해도자동 응모라고 하니까 저렴한..."
"삼성 그랑데건조기 dv14n8520kv, kp 미개봉 새제품 판매합니다. ...","선입금x +삼성 에어드레서 판매중, 삼성 그랑데건조기 미개봉 세제품 판매합니다.이녹스. 블랙캐비어.색상 실내키트 추가시 10만원 삼성 에어드레서 미개봉 제품도 ..."
"삼성 그랑데건조기 dv14n8520kv, kp 미개봉 새제품 판매합니다. ...","선입금x +삼성 에어드레서 판매중, 삼성 그랑데건조기 미개봉 세제품 판매합니다.이녹스. 블랙캐비어.색상 실내키트 추가시 10만원 삼성 에어드레서 미개봉 제품도 ..."
드디어 이사! 가습기 +공기 청정기= 어디꺼가 가성비 좋을까요?,"지혜롭게 센스있게 사시는 여러분의 소중한 의견이 궁금합니다. 어느제품이 좋을까요? 감사합니다 (에어 드레서도 필요할까?) 미니멀리즘으로 살고 싶은데, 막상 보니 ..."
스타일러 어떤가요?,겨울 외투때문에 스타일러를 들일까 말까 또 고민하네요. 최근에 삼*에서 에어드레서도 나오고~~혹시 스타일러나 에어드레서 쓰시는 분들 솔직평 부탁해도 될까요?
★현대정수기렌탈케어★현대정수기/현대정수기렌탈/큐밍정수기/현...,"삼성/에어드레서/삼성세탁기, ★ 고객만족도 우수기업 현대렌탈케어 2019 렌탈 EVENT ★ ◈ 현대랜탈케어 2019년 2월 렌탈 프로모션 ◈ - 제휴카드 최고 ..."
삼성 에어드레서 DF60N8500BG 미개봉새제품팝니다 선입금x 단순개...,"개인거래(판매), 판매완료, 가격 1,100,000원, 안전거래 미사용, 삼성 에어드레서 DF60N8500BG 미개봉새제품팝니다 선입금x 단순개봉품 있습니다,..."
"삼성 그랑데건조기 dv14n8520kv, kp 미개봉 새제품 판매합니다. ...","선입금x +삼성 에어드레서 판매중, 삼성 그랑데건조기 미개봉 세제품 판매합니다.이녹스. 블랙캐비어.색상 실내키트 추가시 10만원 삼성 에어드레서 미개봉 제품도 ..."
스타일러 써보신분,[※글 작성시 위 나이키매니아 공식협력업체 배너를 삭제하시면 활동정지 대상이오니 유의하시기 바랍니다] 찾아보니 120정도 하는것같은데에어드레서랑 스타일러랑 유명한것같은데요.돈값하나요?.....
가전견적 공유해요!,하이마트 rq48n9103s8 김치냉장고 양문형 메탈선반 wr20n9970kv 세탁기 통돌+드럼 20k vs80n8082k2 에어드레서 미러 3벌 vca-sst85 무선청소기 전체 툴세트+스탠드거치대 32인치 커브드 게이밍모니터 전부 삼성...
"플레이스테이션(35,900원) 외 4개 상품","kr/products/88521859에어드레서+건조기 케어서비스39,900 원 (무료배송) 상품확인하기 http://m.bunjang.co.kr/products/..."
삼성에어드레서 새제품(미개봉) 판매합니다 :),"개인거래(판매), 판매중, 가격 1,000,000원, 안전거래 미사용, 삼성에어드레서 새제품(미개봉) 판매합니다 :), 박스 미개봉 새제품이구요,지역은 부산 , ..."
인천 DF60N8700MG 삼성에어드레서 골드미러 새상품 박스안뜯음 판...,"개인거래(판매), 판매완료, 가격 1,400,000원, 안전거래 미사용, 인천 DF60N8700MG 삼성에어드레서 골드미러 새상품 박스안뜯음 판매합니다., DF6..."
크.. 기계욕심이 많으니 힘들구만요.,이제 식기세척기와 에어드레서만 사면 되는데 남편 구워삶기 힘드네요. 관리도 귀찮아요.. 청소해 줘야지 필터 갈아줘야지 닦아줘야지 고장나면 고쳐줘야지 뭣보다 전기세보면 퐈이아입니다. 15만원..?...
응모만해도 스마일캐시 100원 2천원 쿠폰~ 지구 트렌드트럭 이벵...,"응모만해도 스마일캐시 100원 2천원 쿠폰~ 준다고 하는데 너무 쉬워요 ㅎㅎㅎ 아이폰 XR, 에어팟, 삼성 에어드레서, 에어팟, 막스마라코트, 몽클레어패딩,프라엘..."
삼성에어드레서 오군가전렌탈샵,"삼성에어드레서 오군가전렌탈샵 안녕하세요? 오군가전렌탈샵 2호점 입니다. 요즘 방송광고를 보다보면 삼성에어드레서 많이 나오죠~ 삼성에어드레서 뿐만 아니라 스타일러,..."
삼성전자 에어드레서 DF60N8700MG 의류관리기 판매합니다도 그놈...,"------------------------------------------------- 사기피해를 줄이는 가장 기본적인 습관, 검색 https://cafe.na..."
대구에서 세종으로 용달 이용시.. 어느쪽을 이용해야하나요?,대구에서 개당 90kg정도 되는 에어드레서 3개정도 실어오려고 하는데 차는 0.5톤이나 1톤..이면 될것같거든요.. 대구에 있는 용달 업체를 이용하는게.나을까요? 아니면 세종의 업체를 이용하는게 나을까요?
★삼성 에어드레서(화이트/브라운/로즈/골드미러) 새제품 최저가...,"개인거래(판매), 판매중, 가격 62,000원, 안전거래(네이버페이), ★삼성 에어드레서(화이트/브라운/로즈/골드미러) 새제품 최저가 판매합니다, 24시 상담문의..."
삼성디지털프라자 무료 사은품 .....,건조기랑 에어드레서도 구입할예정이라서 겸사겸사 구경 고있는데 이름은 기억이 안나는데 키가아담하신분이 정말 친절친절이 성명 해주시고 아직 급한게 아니 라고했더니 3...
"1월 출산예정인데, 가전제품 조언부탁드려요^^","스타일러(or에어드레서)는 다림질용도 원하는거 아니고, 미세먼지도 없애주고 한다니까..옷 관리하기 좋을거같고. 빨래건조대 사려고 검색하다보니 그냥 건조기가 답이라는 얘기가 많아서..ㅎㅎ 셋 다..."
명품x 에어드레서살까요?,이거 사면 코트나 버버리 이런거 드라이 안 맡겨도 되는거ㅜ맞죠? 옷 망가지기 싫어요ㅠㅠ
★삼성 에어드레서(화이트/브라운/로즈/골드미러) 새제품 최저가...,"개인거래(판매), 판매완료, 가격 62,000원, 안전거래(네이버페이), ★삼성 에어드레서(화이트/브라운/로즈/골드미러) 새제품 최저가 판매합니다, 24시 상담문..."
다이렉트웨딩×삼성전자 박람회 다녀왔습니다.,"고사양(65인치 Qled, 23kg플렉스워시, 14kg건조기,t9000 4도어 쇼케이스 냉장고, 에어드레서골드라벨,스마트지능 공기청정무풍에어컨 2in1,파워건청소..."
[코웨이] 혁신 아이템!! 의류청정기 비교분석,"의류청정기 제품 3대장으로스타일러(LG),에어드레서(삼성),사계절의류청정기(코웨이)3사 제품에대해 자세하게 비교가되어있는 내용으로 안내해드릴까 합니다~! 일단!!..."
삼성 에어드레서 최고급형 골드미러 미사용 새제품 수원,"개인거래(판매), 판매중, 가격 1,150,000원, 안전거래 미사용, 삼성 에어드레서 최고급형 골드미러 미사용 새제품 수원, 최근 배송받은 삼성 에어드레서 단순..."
삼성에어드레서 판매합니다~~(판매완료),"개인거래(판매), 판매중, 가격 1,000,000원, 안전거래 미사용, 삼성에어드레서 판매합니다~~(판매완료), 박스 미개봉 새제품이구요,지역은 부산 , 모델명은..."
"가전제품 절반값!삼성에어드레서,삼성14키로건조기,초특가 sk매직...","개인거래(판매), 판매중, 가격 1,000,000원, 안전거래 미사용, 가전제품 절반값!삼성에어드레서,삼성14키로건조기,초특가 sk매직식기세척기12인용,건조기,안..."
삼성전자 에어드레서 DF60N8500BG 미개봉새제품 판매. 단순개봉품...,"개인거래(판매), 판매완료, 가격 1,100,000원, 안전거래 미사용, 삼성전자 에어드레서 DF60N8500BG 미개봉새제품 판매. 단순개봉품도 있습니다. 선입..."
"삼성무풍2in1(45,000원) 외 4개 상품","삼성무풍2in145,000 원 상품확인하기 http://m.bunjang.co.kr/products/87603054삼성에어드레서52,000 원 (무료배송) 상품확..."
[광고] 우리모텔이 다른모텔과 차별화 되는 방법!,"기나긴 고민끝에 내린 답은 하나!★LG 스타일러 또는 삼성 에어드레서★ 요즘 가정집에서도, 호텔에서도 가장 인기있는 제품""LG 스타일러 또는 삼성 에어드..."
스타일러(의류청정기) 추천해주세요,"겨울되니까 옷에 냄새밴거 빼기도 번가롭고 옷을 자주 빨면 옷감이 상하는거 같아 스타일러를 사려고 해요~ 대표적인 브랜드가 LG스타일러, 삼성 에어드레서, 코웨이 의류청정기 이렇게..."
에어드레서 배송도 하지않은 새제품,"개인거래(판매), 판매완료, 가격 1,000,000원, 안전거래 미사용, 에어드레서 배송도 하지않은 새제품, 배송도 하지않은 새제품입니다. 제품코드는 DF60N8..."
[배송지변경] 삼성 에어드레서 골드미러,"개인거래(판매), 판매중, 가격 1,450,000원, 안전거래 미사용, [배송지변경] 삼성 에어드레서 골드미러, 요즘처럼 미세먼지 많을때는 .특히 애완동물이나 아..."
에어드레서 새상품 배송해드려요,"개인거래(판매), 판매중, 가격 1,200,000원, 안전거래 미사용, 에어드레서 새상품 배송해드려요, 선물로 받기로했는데 저희집엔 둘때가없어 팔아요 아직배송전..."
다들 향수 몇방 뿌리세요?,"저는 톰포드 토바코우드,바닐파탈 사용하는데 향이 쎈 제품들이잖아요 원래는 목에 2방 양쪽 손목에 한방씩 총 4방뿌리는데 이번에 에어드레서 사고 양쪽 어깨에 한방씩..."
"신세계야, 잘가ㅠㅠㅠㅠ 롯데백화점 인천터미널점한테 문자왔어요...","경품 페스티벌 [1.4(금)~1.13(일), 5층 사은행사장] - 경품내용 : 삼성 에어드레서, LG 트롬건조기, LG 공기청정기 外 2019개의 HOT TREND 상품 - 대상 : L.POINT카드 소지고객 Event2. 인기가수 릴레이 콘서트..."
삼성 에어드레서 단순박스개봉 미사용 새제품 수원,"개인거래(판매), 판매완료, 가격 1,100,000원, 안전거래 미사용, 삼성 에어드레서 단순박스개봉 미사용 새제품 수원, 최근 출시한 삼성 에어드레서 단순박스개..."
저두 삼성 디지털 프라자 다녀왔어요,사실전 입원중인데 부영 사전점검때문에 외출 해서 나온김에 갔어요 담도에 담석 넘어가서 본의 아니게 거의 20일 입원이네요 ㅜㅜ 전 건조기 9키로 쓰는데 이불때문에...
위닉스제습기 9만원,"개인거래(판매), 판매완료, 가격 90,000원, 안전거래 미사용, 위닉스제습기 9만원, 위닉스제습기직거래로팝니다.에어드레서구매해서제습기가필요없어서요ㅡ직거래원해요"
삼성 에어드레서(스타일러) 우드브라운 새제품 판매합니다,"개인거래(판매), 판매완료, 가격 1,100,000원, 안전거래 미사용, 삼성 에어드레서(스타일러) 우드브라운 새제품 판매합니다, 삼성 에어드레서 ( 스타일러 )..."
삼성전자 에어드레서 DF60N8500BG 미개봉새제품 판매. 단순개봉품...,"개인거래(판매), 판매완료, 가격 1,100,000원, 안전거래 미사용, 삼성전자 에어드레서 DF60N8500BG 미개봉새제품 판매. 단순개봉품도 있습니다. 선입..."
수원 아이파크캐슬 전세 세입자 구해 봅니다.,※ 직거래인만큼 부동산수수료 아꼇으니 입주선물로 입주기간동안 사용하시라고 에어드레서(의류관리) 공급 예정입니다. - 댓글은 못볼수 있어 쪽지로 연락처 남겨주시면 연락드릴께요 (빨리 연락주신분...
"삼성 UHD 스마트TV 65인치-UN65NU7450FXKR(빠른배송)(51,000원) ...","kr/products/91844863삼성 에어드레서 브라운 3벌+3벌 - DF60N8500BG55,000 원 (무료배송) 상품확인하기 http://m.bunjan..."
스타일러질문입니다,"1)lg 스타일러 2)삼성 에어드레서 3)코웨이 사계절의류청정기 위 세가지 중에서, 써보신분들이나 아는정보있음 공유 부탁드려도될까요? 추천 마구 부탁드려요~~~! 꾸벅~~~~~"
에어드레서 배송도 하지않은 새제품,"개인거래(판매), 판매완료, 가격 1,000,000원, 안전거래 미사용, 에어드레서 배송도 하지않은 새제품, 배송도 하지않은 새제품입니다. 제품코드는 DF60N8..."
삼성 에어드레서 골드미러 새상품 110만원에 판매합니다,"개인거래(판매), 판매완료, 가격 1,100,000원, 안전거래 미사용, 삼성 에어드레서 골드미러 새상품 110만원에 판매합니다, 삼성 에어드레서 골드미러 색상 ..."
우장산 아덴하임 분양가&모델하우스 예약안내문자24시,"우장산 아덴하임은 빌트인 냉장고와,전자렌지,세탁기,에어드레서와 같은 고품격 풀퍼니시드 시스템을적용하여 풀옵션이라고 합니다. 그리고 IOT시스템을 적용하여생활가전,..."
세탁기렌탈로 저렴하게 득템!,"해주는데 제휴카드할인까지 받을 수 있어서 시중보다 저렴하거든요! 냉장고, TV, 다이슨제품, 에어드레서등등 가전제품 많으니까 구경해보셔도 되고요~ https://..."
"""고마운"" 삼성에어드레서",
감사의미 응원메세지 이벵 당첨결과!!,스타일러 #에어드레서 #커피머신기 #렌탈 #상조 #적금 #라이프상조 #여행#교원더오름이은숙 #교원더오름에메랄드이은숙#교원더오름뷰티강사이은숙 #빅사이즈팀 #밀양#0...
인천 DF60N8700MG 삼성에어드레서 골드미러 새상품 박스안뜯음 판...,"개인거래(판매), 판매완료, 가격 1,400,000원, 안전거래 미사용, 인천 DF60N8700MG 삼성에어드레서 골드미러 새상품 박스안뜯음 판매합니다., DF6..."
삼성에어드레서 DF60N8300WG 100만원에 판매합니다 :) (미개봉 새...,"개인거래(판매), 판매중, 가격 1,000,000원, 안전거래 미사용, 삼성에어드레서 DF60N8300WG 100만원에 판매합니다 :) (미개봉 새상품), 박스 ..."
[DF60N8500RG] 삼성의류청정기 에어드레서 우드로즈 특별 할인 기...,"<글양식 삭제 금지>* 카페는 광고업체의 정보를 게시 허용할 뿐, 거래의 당사자가 아닙니다. 따라서 거래에 관한 권한 및 책임은 각 업체와 계약자에게 ..."
이번 가전제품을 사면서 엘지vs삼성 고민했다만 끝까지 의문점..,코드제로 나온 뒤 파워건..스타일러 나온 뒤 에어드레서 트롬 건조기 나온 뒤 그랑데 ... 그래서 항상 엘지 가전이 대명사가 되는듯한 느낌??! 더 웃긴건 삼성 모바일은 oled 쓰면서 티비 만드는 기술이...
삼성 에어드레서 도착했습니다! (후기),가더라구요 에어드레서를 돌리는 동안(39분) 절대 향이 빠질수 없는 향수입니다 꺼내서 냄새를 맡아봤는데.. 경이롭네요 딱 처음 냄새를 맡을때만 살짝 바닐라향이 올...
삼성에어드레서 우드브라운 미사용새제품 100에 팝니다,"개인거래(판매), 판매완료, 가격 1,000,000원, 안전거래 미사용, 삼성에어드레서 우드브라운 미사용새제품 100에 팝니다, 삼성 에어드레서 미사용새제품 입니..."
이사 궁금한게 있습니다.,혹시 에어드레서 옮길때 주의사항 있나요? 무게는 어느정도 나가요?ㅎㅎ
좋네여 !!ㅋㅋ,에어 드레서 싸게 구매해서 잘 사용하도록 해야겟습니다 ㅎㅎ
드디어 안정권...전기세 포기,의류는 에어드레서가 공기 담당 공청기들과 조금 더 순환을 도와주는 청소기 세상이 변할수록 가전들은 진화하고.. 이러다 집안에서만 살아야하나요 전기세는 난리날듯 싶...
"삼성 냉장고 317L - RT32K5030WW(20,900원) 외 4개 상품","kr/products/91856484삼성 에어드레서 골드미러 3벌+3벌 - DF60N8700MG60,000 원 (무료배송) 상품확인하기 http://m.bunja..."
용산 아쿠아맨 아이맥스 3D,"어제 아이맥스 3D로 보았습니다 올해 최고의 영상미로 남을 영화였어요 상영전 시간이 남아서 커피마시려고 ""cine de chef""갔는데 에어드레..."
견적문의드려요,스타일러 s3mfc가격하고 에어드레서 골드미러 가격 두개 견적부탁드려요
육아나 살림 도움되는 효자템 또 뭐있을까요?,ㅎㅎ 아기세탁기 건조기정수기식기세척기에어프라이어 기본 가전제품(냉장고 세탁기 티비 등)외에제가 사길잘했다는것들은 요아템들이에요 ㅎㅎ 이제 곧 들이는건 에어드레서음식물쓰레기처리기(인싱크..)...
"삼성통돌이 14kg(21,900원) 외 4개 상품","kr/products/96643778삼성 에어드레서 골드미러 특가41,000 원 (무료배송) 상품확인하기 http://m.bunjang.co.kr/products..."
하이마트 가전견적 봐주세요~,세트) 에어드레서 삼성 3구 브라운색상 179만원 에어컨 삼성 무풍 2in1 AF16N5779WZR 200만원 공기청정기 삼성큐브 메탈 65만원 전기레인지 쿠첸하이라이트 3구 50만원 정수기 코웨이 냉정수기 CP-243N...
위례트레이더스 오픈기념1등!!,에어드레서!!! 겁나게 부럽네요... 직원들이 소리지르고 박수치고ㅋㅋ 부럽네요ㅠ #당첨되도울집엔둘곳도없네ㅠㅠ ★ 글쓰기 주의사항 ★ - 게시판 말머리 선택 해주세요 - 비난. 비방글. 불만글 금지...
로라스타 스팀다리미 쓰시는 시크님들..?!,좋다고 사셨는데 몇달 사용하면서 어떠신지 궁금해요~!!! 저가격에 충분히 가치가 있는지... 에어드레서 포기하고 사는거라.. 다림질 편하게 하고싶네요 ㅠㅠ 에어드...
