날짜,제목,본문요약본
2019.02.02. ,삼성 에어드레서 체험단 모집,미세먼지에 너무나도 민감한 안주인과 7살 아들.. 눈독 드리던 에어드레서 체험단으로 한번 사용 해보자 #진정한의류청정 #삼성에어드레서 #미세먼지필수템 #인테리어가전
12시간 전 ,"삼성에어드레서 ,우리집 로망템이자 똑소리 나는 인테리어가전",3120ann.blog.me 삼성에어드레서 이번체험단을 선정하시는 관계자님들 꼭 봐주셨으면 하는 제 리뷰 인데요. 작년에 삼성디지털프라자 건조기 후기 이벤트 가 열렸었는데...
2018.11.23. ,미세먼지 안심가전 체험단 삼성 에어드레서 골드 미러 설치...,드뎌 미세먼지 안심가전 체험단 으로 삼성 에어드레서 우리집에 도착 하다~~ 미리 그전에 설치 스캐줄 잡아주시고~~ 당일 아침에는 몇시쯤 오시겠다고 연락 주셔서...
2018.10.28. ,에어드레서 그랑데 삼성큐브 올 ALL 체험단 신청,#삼성에어드레서 #에어드레서 #미세먼지 #안심가전체험단 #삼성건조기그랑데 #그랑데 #미세먼지 #안심가전체험단 #삼성큐브 #삼성공기청정기 #미세먼지 #안심가전체험단...
2018.10.31. ,"미세먼지 날려버릴 삼성 에어드레서와 그랑데, 삼성큐브 체험단","각각의 체험단 지원 대상은 삼성 에어드레서를 비롯하여 건조기 그랑데, 공기청정기인 삼성 큐브로 나눠져있는데요. 세가지 모든 가전제품에 지원할 수 있으며..."
2019.02.10. ,삼성 에어드레서 체험단 모집,삼성 에어드레서 체험단 모집
2018.10.27. ,미세먼지 안심가전 체험단에 응모하세요 - 삼성에어드레서,미세먼지 없이 깨끗한 옷을 입을 수 있게 해주는 #에어드레서 지요. 삼성전자의 #미세먼지 안심가전 체험단을 통해서 미세먼지 없이 안심할 수 있는 생활을 하자구요.
2018.10.25. ,체험단모집:) 새로운 청정의류의 진리템 #삼성에어드레서...,청정의류의 #진리템 #삼성에어드레서 대용량 건조의 시작 #인생템 #삼성건조기그랑데 초미세먼지보다 더 작은 먼지까지 #필수템 #삼성큐브 미세먼지 안전가전 체험단...
2018.10.29. ,삼성 미세먼지 안심가전 체험단 모집 [에어드레서 그랑데...,삼성 미세먼지 안심가전 체험단 모집 [에어드레서 그랑데 삼성큐브] 여러분... 삼성 에어드레서 체험단 10명 삼성 건조기 그랑데 체험담 10명 삼성 큐브 체험단 10명 총...
2018.10.28. ,"미세먼지 안심가전 체험단, - 삼성 에어 드레서 체험단 신청 -",갑갑한 미세먼지 시즌이 다가오고있습니다 마침 삼성 미세먼지 안심가전 체험단 모집~~ 제품은 총 세 가지 - 삼성 에어 드레서 - - 삼성 건조기...
6일 전 ,[공유 :: 삼성전자 리뷰어모집] 삼성 의류청정기 ‘에어드레서...,무료체험단 모집 마케팅에 심여를 기울이는 것 같아요! 저도 체험해보고자... 맞벌이 부부의 로망템 삼성 에어드레서 출시~ 리뷰어모집해요 :D 매일 정장입고 출근하는...
2018.10.25. ,Daily 미세먼지 제거에 효과적인 삼성 에어드레서!? 체험단...,#에어드레서 #삼성큐브 #건조기그랑데 체험단을 모집 중이에요~!! 이미 삼성 큐브는 제가 신청을 한 상태고 두 번째로 신청하는 게 삼성 에어드레서입니당ㅎㅎ...
2018.10.29. ,삼성전자 미세먼지 안심가전 에어드레서 체험단 모집 소식...,우리집 인테리어까지 책임지는 삼성 에어드레서! 정말 체험해 보고 싶어요!! #삼성에어드레서 #에어드레서 #미세먼지 #안심가전체험단 #삼성전자 #삼성닷컴 #진리템
2019.02.12. ,삼성 에어드레서 리뷰어 의류청정기 체험단 / 리뷰어...,"#삼성에어드레서, #에어드레서 #의류관리기 #의류청정기 #삼성전자 #체험단모집 #리뷰어모집 #미세먼지 #옷드라이 요즘 날씨에 필수템인 ""삼성 에어드레서"" 넘나..."
2018.10.20. ,삼성 에어드레서 후기! 나의 첫 의류관리기 @원룸인테리어,삼성 에어드레서 1주일 체험단으로 당첨되서 쓰는거라 그 동안 열심히 썼어요 !!... 본 포스팅은 삼성 에어드레서 체험단으로 선정되어 무상대여를 받아 작성하였습니다
2018.10.30. ,네이버 무료체험단 모집 삼성 에어드레서 (DF60N8500BG),네이버 무료체험단 모집 삼성 에어드레서 (DF60N8500BG) 무료체험 2018.10.22. 오전 12:00 이벤트기간 2018.10.22.(월) 00:00~2018.11.04.(일) 23:59 당첨자발표 2018.11.09....
2018.10.31. ,체험단 : 옷에 붙은 미세먼지까지 한번에! 삼성 에어드레서,안심가전체험단 : NO.1 삼성 에어드레서 최근에 알게된 삼성스토어에서 하는 안심가전체험단 첫번째!! 삼성 에어드레서 체험단에 대해서 알려드릴께요! 저 뿐만아니라...
2018.10.29. ,"삼성 미세먼지 안심가전 체험단 모집 당첨(에어드레서, 그랑데...","삼성 에어드레서 체험단 10명 산성 건조기 그랑데 체험단 10명 삼성 큐브 체험단 10명 그리고 아쉽게 떨어진 분들을 위한 커피 키프티콘 100명 저는, 에어드레서, 그랑데..."
6일 전 ,꿈꾼다면 삼성에어드레서가 답이다!(삼성에어드레서체험단모집),바로~~~#삼성에어드레서!! #삼성에어드레서 는 #미세먼지 필수템이죠~^^ 미세먼지 필수템이자 신혼부부의 #로망템 #삼성에어드레서 를 체험할 수 있는 좋은 기회가 있어...
2018.09.15. ,"[체험단 모집] 의류 청정시대 시작, 삼성 에어드레서와 만나다.",없는 에어드레서 실물 보여드릴께요. 페이지 마지막에 체험단 링크도... 에어드레서 사전예약과 자세한 사항은 삼성전자 공홈링크예요. 에어드레서 체험단 신청...
2018.10.25. ,"삼성 에어드레서,삼성건조기 그랑데,삼성 큐브 체험단 모집!!!!...",여러분도 한번 응모해보세요 ^ㅡ^ https://www.samsung.com/sec/event/homecare/?cid=kr_banner_naverr_homecare_20181023 #삼성에어드레서 #에어드레서 #미세먼지 #안심가전체험단...
2019.02.10. ,삼성에어드레서 체험단 신청하기~!,#진정한의류청정 #삼성에어드레서 #미세먼지필수템 #인테리어가전 오른쪽 왼쪽 중 행거 옆에 두면 너무 좋을거같다
2018.10.31. ,"삼성 미세먼지 안심가전 에어드레서, 그랑데, 삼성큐브 체험단...",그래서 저도 저희 가족 위해서 꼭 필요한 미세먼지 안심가전이 있어서 이번 삼성 체험단 응모해 보았는데요.^^ 바로 #진리템 삼성에어드레서 꼭 사용해보고 싶더라구요...
2018.10.25. ,삼성 에어드레서 그랑데 큐브 체험단 모집,인지도 최강 삼성전자에서 환절기 필수템 미세먼지 걱정 싹 알려줄 수 있는 핵꿀템 삼성 에어드레서 / 건조기 그랑데 / 공기청정기 큐브 체험단을 모집하는 중이에요....
2018.10.27. ,삼성에어드레서 체험단 모집♡,미세먼지 안심가전 체험단 모집 | 삼성닷컴 http://me2.do/Gfv0gOzM #삼성에어드레서 #에어드레서 #미세먼지 #안심가전체험단
6일 전 ,삼성에어드레서 리뷰어모집 응모하고 멋쟁이 되자고요.,www.samsung.com #삼성에어드레서 #삼성에어드레서골드미러 #삼성에어드레서체험단 #삼성에어드레서리뷰단 #진정한의류청정 #삼성에어드레서 #삼성스타일러...
2018.10.31. ,에어드레서 체험단 신청 고고!!,아기 낳고 나서 집안 청결에 신경쓰게 되었는데 에어드레서로 의류관리하면 좋을 것 같다!!! #삼성에어드레서 #에어드레서 #미세먼지 #안심가전체험단
2019.02.02. ,삼성 에어드레서 체험단 모집!,https://local.sec.samsung.com/comLocal/event/promotion/eventPopup.do?eventId=14384&popupNum=4 삼성 에어드레서 리뷰어 1차 모집 | Samsung 대한민국 성별 남 여 연령대 리뷰어...
2018.10.26. ,"삼성 에어드레서, 그랑데, 삼성큐브 미세먼지 안심가전 체험단...","삼성 에어드레서, 건조기 그랑데, 큐브는 우리가족 건강을 위해서도 꼭 필요한 인생템인데요. 지금 삼성에서 미세먼지 안심가전 체험단 모집을 진행하고 있어 함께..."
2019.02.11. ,삼성 에어드레서 리뷰어 모집,삼성 에어드레서 체험단 함께 신청해보아요 ! 클래식 화이트 컬러를 거실 쇼파... 삼성 에어드레서 리뷰어 모집 | 삼성닷컴 삼성 에어드레서를 놓고 싶은 공간을...
2018.10.26. ,삼성에어드레서 체험단모집,이달말 (2018년 10월기준) 까지 진행되는 삼성에어드레서 체험단 신청을 추천합니다~ #삼성에어드레서#에어드레서#미세먼지 #안심가전체험단#의류관리#양복관리#체험단모집
2018.10.31. ,삼성 에어드레서 그랑데 삼성큐브 안심가전체험단 저도 도전해요!,그러다 알게 된 삼성 안심가전체험단 모집 소식! 옷에 묻은 미세먼지까지 관리해주는 #삼성에어드레서 우리 가족의 옷과 이불빨래까지 보송하게 해주는...
15시간 전 ,"삼성 에어드레서, 미세먼지 필수템!!!","되니 에어드레서가 꼭 필요하더라구요 알아보던 중에 알게된 삼성 에어드레서 체험단! 매우 조금 선정하지만, 그래도 꼭 필요한 가전이라 저도 신청해봅니다. 맞벌이..."
2019.02.10. ,체험단신청-삼성에어드레서,체험단신청!! 새로운 바람과 스팀의 힘! 의류 청정 시대 삼성 에어드레서 #진정한의류청정 #삼성에어드레서 #미세먼지필수템 #인테리어가전 !! 신청합니다. 우선 왜...
2019.02.10. ,<삼성 에어드레서> 이것은 에어드레서인가 공기청정기인가?,나온 에어드레서가 탐났다. 그런데 마침 삼성에어드레서 체험단 소식이! 미세먼지... 4 체험단 신청 방법 체험단 지원 방법 1 에어드레서를 놓고 싶은 공간을 촬영 2...
2018.10.25. ,삼성 의류관리기 에어드레서 체험단 모집!,요즘 의류관리기들 이벤트 중이던데 삼성도 도전! 너무 비싸서 사지는 못하고ㅠㅠ 흑.. #삼성에어드레서 #에어드레서 #인기가전 #안심가전체험단
4일 전 ,"[체험단모집]삼성 에어드레서, 이것이 진정한 의류 청정...","특히, 30대 미혼 남자 에게는 꼭 필요한 가전이 아닐까 싶네요~ㅋㅋ 삼성홈페이지에서 에어드레서 리뷰어 모집한다고 하니 이기회게 필요 하신분들은 한번..."
2018.10.31. ,"[체험단] 삼성 에어드레서, 건조기, 큐브 체험단 이벤트가 있어요!","바로바로, 삼성 에어드레서와 건조기, 큐브(공기청정기) 체험단을 모집한다고 해요! 더웠던 여름을 지나, 이제 곧 미세먼지가 벌써부터 하늘을 뒤덮고 있는데, 이렇게..."
4일 전 ,삼성 에어드레서 리뷰어 모집 (신청 완료:함께해요!),리뷰어 체험단에 참여를 하고 있는 중 입니다. ^ ^ 리뷰어 모집 자세한 사항(원본)은 삼성을 클릭해주세요! 삼성 에어드레서 리뷰어 모집 | 삼성닷컴 삼성...
2019.02.11. ,삼성에어드레서 삼성에서 대박 이벤트 체험단 신청,삼성에어드레서 2차 리뷰 체험단 모집 이번에 삼성에서 삼성에어드레서에 대한 리뷰어를 모집하고 있습니다. 어떻게 본다면 삼성 입장에서는 큰돈을 들이지 않고...
2018.10.25. ,삼성 (에어 드레서)× (그랑데×큐브) 체험단♡,가전-체험단 #미세-먼지-타파 #삼성-에어-드레서 #삼성-그랑데 #삼성-큐브 #삼성-공기-청정기 #쾌적한-집안-환경-만들기 에어드레서 체험단 바로가기(♡) https...
2018.11.04. ,삼성 에어드레서 최저가 구매 팁,"- 다른 제품들과 달리 에어드레서는 유통 경로에 따른 모델 구분이 없는 것으로 보여, 싸게 구매하는 것이 최고 인 것 같습니다. * 본 게시물은 릴레이 체험단 선정으로..."
2018.10.19. ,삼성 에어드레서 무료 체험단 및 특별 혜택에 도전해보세요!...,"#네이버체험단 #DF60N8700MG #삼성에어드레서 #의류청정기 STEP 2. ""내가 삼성 에어드레서를 꼭 사용해야 하는 이유""를 댓글로 남겨주세요. STEP 3. 아래 링크된..."
2018.10.31. ,삼성 에어드레서 체험단 참여합니다!!~~ 제품3종 All체험단,https://www.samsung.com/sec/event/homecare/?cid=kr_banner_naverb_homecare_20181023 #삼성에어드레서 #에어드레서 #미세먼지 #안심가전체험단
2018.10.31. ,"미세먼지 안심가전(에어드레서, 건조기 그랑데, 큐브) 체험단...","이름하여, 삼성 에어드레서, 삼성 건조기 그랑데, 삼성 큐브! 실로 경이로운 물건들인 듯해요. 체험하고 싶네요. 다른 분들도 체험단 신청해보세요~^^*"
2018.10.25. ,"[삼성] 에어드레서, 그랑데, 삼성큐브 체험단 모집",에어드레서 건조기 그랑데 삼성 큐브 체험단을 모집합니다 기간은 2018.10.23~2018.10.31 입니다 에어드레서 : 옷을 뽀송뽀송하게 해주는 아이언맨 슈트 저장고입니다...
2019.02.13. ,삼성에어드레서 리뷰어( 체험단 ) 모집,#미세먼지필수템 #인테리어가전 #진정한의류청정 #삼성에어드레서
15시간 전 ,[이벤트 응모] 삼성 에어드레서 리뷰어 응모 ♥,"19.02.20 몇일 전 폰하다가 발견한 삼성 에어드레서 체험단 그니가 요즘에 에어드레서 엄청 관심있어 했는데 기회다 싶어서 바로 검색!!!! 네이버에 ""삼성에어드레서체험단..."
2018.12.28. ,"의류관리기 추천, 삼성 에어드레서 실제 사용후기",삼성 에어드레서 안심가전체험단으로 5주동안 사용해본 총평으로는 꼭 추천하고싶은 가전제품이라는것 미세먼지가 점점 심해지고 있는 요즘엔 필수가전제품이 될 것...
14시간 전 ,삼성 에어드레서가 필요해~,삼성 에어드레서가 나왔다는 소문을 접한 달콤초코! #로망템 바로 비교 검색에 들어간다~!!!! 거기다 이제서야 발견했지만 삼성에어드레서 체험단! (그래도 발견한게...
2018.10.30. ,[체험단] 삼성 에어드레서 안심가전 체험단 신청/ 10.31 마감!,"------------------------------------------------------------------------------------ 삼성에서 체험단 모집하고 있는 제품은 삼성 에어드레서, 건조기 그랑데, 공기청정기인 큐브 세가지..."
2018.10.25. ,삼성 에어드레서 미세먼지 안심가전 체험단 :),"아이템 체험단 모집이 뙇! 삼성에어드레서 , 삼성건조기그랑데, 삼성큐브 총 33명의 당첨자를 뽑는다고 하니.. 우리 모두 서둘러 응모해보자구요♡ ::체험단 이벤트..."
2019.02.06. ,삼성 에어드레서 체험단 모집중!,"삼성 무풍 갤러리 체험단 | 삼성닷컴 나의 블로그와 SNS, 카페에 체험단 모집 소식을 공유하고, 공유한 URL과 제품을 갖고 싶은 이유를 작성해주세요. TIP www.samsung.com..."
2019.02.09. ,삼성 에어드레서 체험단 신청해요,에어드레서가 너무너무 탐나서 이렇게 신청해봅니다♥️ 좋은결과 얻을수있길
2018.10.21. ,삼성 에어드레서 생생후기 > 삶의 질이 달라지는 의류청정기...,"삼성전자 에어드레서 릴레이 체험단을 진행하면서 짧은 시간이였지만, 매일 매일 알차게 쓴 전자제품이 또 있을까 싶었습니다 출근하는 신랑, 늘 옷에 투자하는 저..."
6일 전 ,[체험단] 삼성 에어드레서,이것은 인테리어 가구인가 에어드레서인가 이보다 멋있는 가구는 없었다. 삼성 에어드레서! 요즘 미세먼지 때문에 건강문제도 있고 옷에 먼지나 오염물들이 많이...
5일 전 ,삼성에어드레서 리뷰어 신청,에어드레서 TV광고를 보는 중에 아래쪽 작은 글씨로 체험단 모집한다는 내용을 봤다. 평소에 아내가 #삼성에어드레서를 탐내고 있었기 때문에 신청하러 들어갔다....
22시간 전 ,삼성에어드레서로 하루종일 상쾌한 옷을 입어요,#삼성에어드레서 #삼성에어드레서체험단 #미세먼지필수템 #인테리어가전 #로망템 이사온곳이 좀 공간이 좁지만 삼성에어드레서를 놓고 싶어요. 1층이라 습한곳이고...
2018.10.30. ,"삼성 에어드레서, 그랑데, 큐브 체험단 모집 :D",정말 진리템 인생템 필수템을 모아모아 진행하는 삼성 미세먼지 안심가전 체험단!... 않은 에어드레서! 그치만 이미 입소문과 써본사람은 다 안다는 그 편리함~ 매일...
2018.10.13. ,우리집 인테리어의 화룡점정 삼성 에어드레서 사용 후기,"자주 빨 수 없는 옷의 리얼케어, 리얼청정, 리얼탈취, 리얼살균, 리얼 주름관리을 할 수 있는 삼성 에어드레서 입니다. 본 게시물은 릴레이 체험단 선정으로 제품을 대여..."
2일 전 ,삼성 에어드레서 진정한 의류청정 이룰 로망템이야~!,삼성 에어드레서가 정말 눈에 쏙 들어오던데. 이렇게 체험단 소식을 접할 줄이야 오예~ 당장 응모합니다^^ 2월 20일까지 모집하니 얼마 안 남았어요. 이웃님들 허뤼업!!...
2018.10.25. ,삼성에어드레서 체험단 모집,추운데도 미세먼지 걱정하는 시대가 왔을때부터 가지고싶었던 에어드레서 옷 원단의 특성상 잠깐 입은 옷을 매번 드라이 할 수 없고ㅜ 그렇다고 다시 그대로 걸어...
2019.02.05. ,[EVENT] 삼성 에어드레서 리뷰어 모집! (~2/20),"안녕하세요, 연어캔 입니다 :) 삼성에서 삼성 에어드레서 체험단을... 선발된 에어드레서 리뷰어 중 미션수행을 모두 완료하신 분께 체험제품 1종 증정 삼성..."
2018.10.29. ,삼성 에어드레서 체험단 댓글 올리기,진심 저도 가족과 함께 체험해 보고 싶습니다. 울 가족에게도 행운이 오길 기대하겠습니다 http://naver.me/G51P5Dg8 #네이버체험단 #DF60N8700MG #삼성에어드레서 #의류청정기
6일 전 ,삼성에어드레서,서히 #필수템#영롱템 에어드레서에 빠져보아요 삼성에어드레서 체험단을 모집... 쉽게 내주지않아요 나 체험단 잘할수 있는데 멋진 말빨말빨 할수 있는데 우리...
2018.10.26. ,삼성 미세먼지 안심가전 체험단 모집 에어드레서 그랑데...,공유하고 체험단에 함께 응모해요! 특히 에어드레서와 큐브는 정말 저희 신혼부부에 필요했던 제품 혼수로 준비하려고 했으나 고민하다가 포기했던...
2018.10.26. ,[삼성전자] 미세먼지 안심가전 체험단 이벤트 - 삼성 에어드레서...,"ALL 체험단: 3명 ( 삼성 에어드레서, 삼성 건조기 그랑데, 삼성 큐브 )- 삼성 에어드레서 체험단: 10명- 삼성 건조기 그랑데 체험단: 10명- 삼성 큐브 체험단..."
2018.10.21. ,궁금했던 삼성 에어드레서 의류청정기 후기,출시 기념으로 페이스북 삼성 채널에서 삼성 에어드레서 x 집꾸미기 릴레이 체험단 40인을 선정했는데 그중에 저도 뽑혔어요 꺅 그래서 일주일 간 체험해보게...
4일 전 ,미세먼지 끝! 신혼집 필수아이템 삼성 에어드레서 :),"겉옷 같은경우는 매일 세탁을 할수도 없고 ㅠㅠ 그래서 신혼 로망템이아닌 필수템이라고 생각하는 ' 에어드레서 , 체험단을 모집한다길래 요래 정보를 공유해요!..."
2019.02.09. ,삼성에어드레서 대박체험단이네요.,매일매일 마트에가서 한번씩 구경하고오는 에어드레서 언제쯤 살까 매일 문열어보고 닫고 열고닫고 냄새맡아보고~ 매일매일 에어드레서에 홀릭되어있는 저를...
2018.12.28. ,필수가전 삼성 에어드레서 2달간 리얼하게 써본 후기 절대적...,#삼성에어드레서 #미세먼지 #안심가전체험단 #의류청정기 #의류청정기추천#의류건조기 #의류관리기 #삼성의류청정기 #에어드레서후기
2019.02.13. ,삼성 에어드레서 리뷰어 모집!,삼성에서 새해맞이 하여 리뷰어 체험단을 많이 모집하네요! 이번에는 '삼성에어드레서'입니다. 요즘 미세먼지는 물론이고 옷관리에 소홀해지게 되는것이...
2018.10.24. ,삼성 에어드레서 체험단 모집,#삼성에어드레서 #에어드레서 #미세먼지 #안심가전체험단 https://www.samsung.com/sec/event/homecare/?cid=kr_banner_naverr_homecare_20181023
2018.10.31. ,삼성큐브 에어드레서 그랑데 체험단 with 라이프스타일의...,"삼성큐브 에어드레서 그랑데 체험단 with 라이프스타일의 변화 기대 TV, 냉장고, 세탁기 위주였던 전통적인 혼수 가전은 기본이고 이제는 건조기, 의류관리기, 공기청정기..."
2019.02.13. ,10년차 패션블로거 삼성에어드레서가 필요해,"인테리어 효과부터 의류관리, 미세먼지로부터의 자유까지 완벽하게 신혼부부의 로망을 자극할 삼성 에어드레서! 체험단으로 활동하게 된다면 사진과 영상을 통해..."
2019.02.11. ,#삼성에어드레서 이벤트 공유 ♡,합니닿ㅎㅎ #삼성에어드레서체험단 신청방법 우선 삼성닷컴 앱에서 AR모드를 실행해서 삼성에어드레서를 촬영합니다 ㅋㅋㅋㅋㅋㅋㅋ넘나리 지저분.... 저는 애플이라...
2018.10.29. ,"이제는 필수아이템 ""삼성 에어드레서""",삼성에서는 에어드레서만 체험단 모집하는게 아니네요.. 건조기와 큐브도 하고 있더라구요. 건조기도 큐브도 넘 탐이나지만 전 지금 에어드레서에 꽂혀있어서......
2018.10.29. ,안심가전 체험단 에어드레서를 우리집에! 도전하세요!,"집에 하나 있으면, 미세먼지와 함께 의류관리의 새로운 시작을 함께 할 수 있을것 같은 에어드레서! 안심가전! #미세먼지 #안심가전체험단 #에어드레서 #그랑데 #삼성큐브"
2019.02.10. ,[삼성에어드레서 리뷰어 신청] 삼성가전덕후의 소망★,삼성에어드레서 체험단 신청 포스팅 입니다 저는 혼수가전을 준비하면서 다... 삼성 에어드레서가 출시되지 않아 LG가 독보적이였는데 내가 애정하는 삼성에서...
2018.10.24. ,삼성 #에어드레서 체험단 소식!!!,#에어드레서? 평소 관심만 가져본 #에어드레서를 체험해 볼 수있는 기회가 생겼네요! 도전! 해보셔요. #삼성 에어드레서 #에어드레서 # 미세먼지 #안전가전체험단
2018.10.28. ,"삼성 에어드레서,그랑데,큐브 체험단 모집","삼성에서 체험단 모집을 하는군요. 필수템인 에어드레서, 건조기, 공기청정기 3종 셋트에 대한 체험단 모집입니다. 이번 집꾸미기의 에어드레서 체험은 1주일 뿐이어서..."
2018.10.26. ,<무료체험단 모집> 삼성 에어드레서 무료체험단...,DF60N8500BG : 우드 브라운 모델 DF60N8700MG : 골드 미러 모델 먼저 삼성 에어드레서 무료체험단 관련 정보부터 알려드린 후에 이번 무료체험단에서 체험하게 될...
2018.10.30. ,"안심가전 체험단 모집 소식 [삼성 에어드레서, 삼성 건조기...",손님들이 방문했을때 에어드레서에 넣었다가 가실때 꺼내드려보세요. 매일 집에 놀러오고 싶을 듯.ㅎㅎ 아래는 구체적인 체험단 소식입니다. ▼ 아래는 링크이니 클릭...
2018.11.02. ,삼성 에어드레서 체험단 모집,"삼성 에어드레서 체험단 모집합니다. 모집 기간은 2018. 10. 22 ~ 2018. 11. 4 입니다. 모집 인원은 2명이고, 발표는 11월 9일입니다."
5일 전 ,어떤 의류도 청정하게 관리할 수 있는 삼성 에어드레서...,선발된 에어드레서 리뷰어모집 중 미션을 모두완료하시면 체험 제품 1종 증정합니다 그리고 에어드레서 체험단 선정이 안되더라도 100명을 추첨해 커피기프티콘을...
2018.10.28. ,[체험단모집] 삼성 에어드레서/그랑데/삼성큐브 (~10/31),삼성에서 체험단을 모집해요*^^* “에어드레서/건조기 그랑데/공기청정기 큐브” 저희 집에 건조기는 있어서 에어드레서와 공기청정기 큐브에 도전 해보려구요...
2018.10.28. ,삼성 에어드레서 체험단 모집!,https://www.samsung.com/sec/event/homecare/?cid=kr_banner_naverr_homecare_20181023 이게 삼성 에어드레서를 선택해야 하는 7가지 이유인데............. 갖고싶다..........
2018.10.31. ,에어드레서 우리집 필수가전,https://www.samsung.com/sec/event/homecare/ 3종 ALL체험단은 바라지도 않아요~ 에어드레서만 주세요~ 네~? < 이벤트 참여를 위해 작성한 포스팅입니다 >
2018.10.30. ,삼성 미세먼지 안심가전! 에어드레서 체험단!,#삼성전자 에서 새롭게 내놓은 #삼성에서드레서 #미세먼지 로 부터 #안심가전 으로 이용 할 수 있는 꿀템! #에어드레서 #안심가전체험단 으로 당신을 #초대 합니다!
2019.02.10. ,삼성에어드레서 푸키네 신혼집 드레스룸 놓고 싶은 필수가전,삼성에어드레서 체험단 지원 합니다 꼬옥 ~~ 행운이 오기를 바라며 신혼집 드레스룸에 빛이 되어 주세요 #진정한의류청정 #삼성에어드레서 #미세먼지필수템...
