날짜,제목,본문요약본
2018.10.08. ,삼성 에어드레서 개봉기 우리집에 도착,페이스북 삼성 채널에서 진행된 삼성 에어드레서 X 집꾸미기 체험단 40인 에 내가 당첨이 되었다는 것 ♪♬ (요즘 당첨 운이 좋단 말이지~) 그동안 한번 입고 세탁하기...
2018.10.25. ,【 삼성 미세먼지 안심가전 체험단 모집 】 삼성 에어드레서ㆍ...,그랑데ㆍ삼성 큐브 삼성 미세먼지 안심가전 체험단을 모집합니다 #미세먼지 #안심가전체험단 #에어드레서 #그랑데 #삼성큐브 삼성 페이스북 ㅡ> https://bit.ly/2RhDO3F
2018.12.13. ,추천하고 싶은 의류청정기 삼성 에어드레서 스페셜 코스로 꺼낼...,관리 할 수 있어서 넘나 좋아요 #삼성에어드레서 #미세먼지 #안심가전체험단 #의류청정기 #의류청정기추천 #의류건조기 #의류관리기 #삼성의류청정기 #에어드레서후기
2018.10.26. ,"LG 스타일러, 삼성 에어드레서 의류관리기 승자는?",삼성은 대행사를 통해서 네이버 플레이윈도라는 소비자 체험 커뮤니티를 활용해 삼성 에어드레서의 체험단을 모집하고 있습니다. 덧) LG와 삼성의 '서체'도 확연한...
2019.02.11. ,#삼성 에어드레서,에어드레서+메탈 김냉까지 세투로 지를까 고민중인데. 써볼 수 있는 체험단 뽑는다하니 손 번쩍 들어봐야지. 너무 갖고싶은 재품. 꼭 써보고싶다아~~~~.
2018.10.25. ,"삼성 에어드레서, 건조기 그랑데, 삼성큐브 공기청정기 체험단...","삼성 에어드레서, 건조기 그랑데, 삼성큐브 공기청정기 체험단모집하네요~ 요즘 미세먼지때문에 신경이 많이 쓰이는데 좋은 제품들 도전해봐야겠어요 ㅎㅎㅎ..."
2018.10.26. ,"지금 바로 삼성 에어드레서,그랑데,삼성큐브 체험단 모집에...",#미세먼지 #안심가전체험단 #에어드레서 #삼성에어드레서
2018.10.31. ,"고마운 삼성에어드레서,그랑데,삼성큐브 체험단 모집","그런 나의 고민 거리를 덜어주려고 나온 ""삼성 에어드레서"" 1. 리얼케어: 겉부터 속까지 2. 리얼청정: 미세먼지 필터 3. 리얼탈취:냄새분해 필터 4. 리얼살균: 바이러스와..."
2018.10.23. ,네이버플레이윈도 :: 삼성 에어드레서 DF60N8700MG 무료체험단,#네이버체험단 #DF60N8700MG #삼성에어드레서 #의류청정기 #갖고싶다 #에어드레서 #네이버쇼핑 #네이버플레이윈도
2018.11.04. ,삼성 에어드레서 무료체험단,삼성 에어드레서 무료체험단 모집(DF60N8500BG) http://naver.me/GciKmRDP
2018.10.27. ,"삼성 에어드레서, 삼성 건조기... 미세먼지 안심가전 체험단 모집","com/sec/event/homecare/?cid=kr_banner_naverr_homecare_20181023 삼성 에어드레서, 삼성 건조기 그랑데, 삼성큐브 미세먼지 안심가전 체험단 모집"
2018.10.29. ,"[삼성미세먼지안심가전체험단]에어드레서,그랑데건조기...","삼성스마트티, 에어컨, 스마트폰,드럼 세탁기 등등 저희 집 가전대부분은 삼성제품이에요 가전 구매시마다 앞서가는 최신 기능과 미려한 디자인, 편리한 A/S때문에 삼성..."
2018.10.23. ,삼성에어드레서 DF60N8500BG 무료체험단,#네이버체험단 #DF60N8500BG #삼성에어드레서 #의류청정기 #갖고싶다 #에어드레서 #네이버쇼핑 #네이버플레이윈도우
2018.10.26. ,"[노랑체험단]삼성에어드레서, 건조기 그랑데, 큐브 체험단 모집",아 체험단 되서 이사갈 집에 에어드레서 딱 놓으면 되는뎅!! 큐브도 조금 탐나지만 나는 에어드레서가 필요하다!!!
6일 전 ,[삼성 에어드레서] 새로운 바람과 스팀의 힘으로 의류청정...,공유한 URL 및 참여 정보를 입력하기만 하면 체험단 신청 완료! 참 쉽고 간단하쥬? 삼성 에어드레서 리뷰어 모집 중이오니 관심있으신 분들은 서두르세요!...
2018.10.29. ,에어드레서 그랑데 삼성큐브 체험단 이벤트[삼성전자],에어드레서/ 그랑데/ 삼성큐브/ 체험단 이벤트[삼성전자] 각각의 제품에 대한 # 어마무시한 체험단 이벤트를 삼성이 하네요 삼성전자 홈페이지에서 지금 신청해보아요...
2018.10.31. ,"삼성 에어드레서, 그랑데, 삼성큐브 육아맘 인생 진리템!","다양한 기능들이 탑재되어 있는 인생 진리템 #안심가전체험단 응모해 만나보세요! #삼성에어드레서 에어와 스팀, 드라이(건조) 그리고 청정으로 옷의 겉부터 속까지..."
2018.10.27. ,미세먼지 안심가전 삼성 에어드레서 그랑데 공기청정기 체험단...,미세먼지 안심가전 체험단 모집 | 삼성닷컴 http://me2.do/xAiABD6f #삼성에어드레서 #에어드레서 #삼성건조기그랑데 #그랑데 #삼성큐브 #삼성공기청정기 #미세먼지...
2018.10.31. ,#삼성큐브 #삼성 에어드레서 #삼성 건조기 그랑데 미세먼지...,"삼성에서 공기청정기, 건조기, 에어드레서 체험단을 모집한다고 합니다!! 이렇게... 공기청정기 체험단을 신청해보려고합니다. 공기청정기를 사려고 돈을 모으고..."
2018.11.01. ,[공유] 삼성 에어드레서 무료체험단 모집(DF60N8500BG),삼성 에어드레서 무료체험단 모집(DF60N8500BG)
2018.10.24. ,삼성에어드레서 무료체험단!!!,"정리 할 수도 없고, 구겨지고, 뭉쳐있는 옷들을 깔끔하게 입어보고 싶어요~! 집이 좁아서 행거를 놓을 수도 없는 공간에 에어드레서로 공간을 잘 활용하고 싶네여!!ㅎㅎㅎ"
2018.10.31. ,[EVENT] 삼성 미세먼지 안심가전 체험단 모집; 에어드레서...,#삼성에어드레서 #삼성건조기그랑데 #그랑데 #삼성큐브 #삼성공기청정기 #에어드레서 #미세먼지 #안심가전체험단
2019.02.09. ,삼성에서 에어드레서 쏜다♡ #삼성에어드레서,삼성 에어드레서로 먼지를 탈탈 털어보시는건 어떠실까요~~ 체험단 응모도 하고 에어드레서 구경도 한번 해보세요! 삼성 홈페이지에서 확인 가능해요 어서 고고♡ 저는...
2018.10.25. ,삼성 에어드레서 & 그랑데 & 큐브 체험단 모집,https://www.samsung.com/sec/event/homecare/ #삼성에어드레서 #에어드레서 #미세먼지 #안심가전체험단 #삼성건조기그랑데 #그랑데 #삼성큐브 #삼성공기청정기
2018.10.23. ,[삼성] 에어드레서 우드브라운 체험단 모집!,삼성 에어드레서 우드브라운 무료 체험단
2018.12.13. ,삼성 에어드레서 하나로 제습기 건조기 기능까지 완벽하게!...,# 삼성 에어드레서 안심가전 체험단으로 삼성 에어드레서를 사용한지 어느덧 3주가 지나고 있네요. 덕분에 삶의질도 함께 업그레이드 되고 있답니다. 만나는 사람마다...
2018.10.26. ,"삼성 에어드레서, 그랑데(삼성건조기), 삼성큐브 체험단 모집 소식","삼성 에어드레서, 그랑데(삼성건조기), 삼성큐브 체험단 모집 소식이 떴길래 공유해 보아요 링크 걸고 뿅 https://www.samsung.com/sec/event/homecare..."
2018.10.28. ,삼성 에어드레서 - 2. SmartThings 연동하기,"체험단을 신청한 이유는 바로 SmartThings 연동 / 활용하기 위해서입니다. 제 블로그를 자주 오시는 분들은 SmartThings에 대한 정보가 많으시겠지만, 에어드레서를..."
2018.10.29. ,"에어드레서,그랑데,삼성큐브 안심가전체험단",에어드레서 미세먼지 안심가전 체험단 모집 | 삼성닷컴 http://me2.do/xAiABD6f
2018.10.26. ,삼성 체험단(에어드레서) 도전!,https://www.samsung.com/sec/event/homecare/?cid=kr_banner_naverr_homecare_20181023 미세먼지 안심가전 체험단 모집 시작! 저도 떨리는 마음으로 응모해봅니다ㅎㅎ...
2018.10.31. ,"삼성 에어드레서, 건조기 그랑데, 삼성 큐브 #인생템 체험하기",#삼성에어드레서 #에어드레서 #미세먼지 #안전가전체험단 리얼케어 리얼청정 리얼탈취 리얼살균 리얼주름관리 리얼공간제습 리얼스마트 !!!!! 게다가 이렇게...
2018.10.25. ,모집 #미세먼지 #안심가전체험단 #에어드레서 #그랑데 #삼성큐브,#미세먼지 #안심가전체험단 #에어드레서 #그랑데 #삼성큐브 #삼성에어드레서
2018.10.24. ,"미세먼지 안전가전 체험단 모집---에어드레서,그랑데,삼성큐브",https://www.samsung.com/sec/event/homecare/ #삼성에어드레서 #에어드레서 #미세먼지 #안전가전체험단 #그랑데 #삼성건조기그랑데 #삼성큐브 #삼성공기청정기
2018.10.30. ,"삼성 에어드레서,그랑데... 기회~!! 미세먼지 안심체험단모집~!",#삼성에어드레서 #미세먼지 #안심가전체험단 #삼성건조기그랑데 #삼성큐브 #삼성공기청정기 #그랑데 #에어드레서 https://www.samsung.com/sec/event/homecare/
2018.10.27. ,삼성 에어드레서 체험단 모집,삼성 미세먼지 안심가전 체험단 모집 이벤트 https://www.samsung.com/sec/event/homecare/
2018.10.27. ,삼성 의류관리기 에어드레서 체험!!,쿨럭) 뭐 그러하여 홈쇼핑 방송때면 늘 아이쇼핑만 하고 있었어요 ㅎㅎㅎ 그러다 이번에 집꾸미기 & 삼성 에어드레서 릴레이 체험단을 모집하길래 놓을 자리 사진 똭!...
2019.02.13. ,삼성전자 2019 무풍에어컨 무풍갤러리 체험단 모집중!,"이런 삼성체험단 신청은 처음인데, 찾아보니까 에어컨 말고도 에어드레서, 청소기 등등 체험단 모집 다양하게 하고 있더라구요!!! 요즘 에어컨 대세가 무풍이라죠, 저도..."
2018.10.26. ,"삼성에서 에어드레서, 그랑떼 큐브체험단을 모집한다고?!",요즈음 핫한 에어드레서 그리고 대형 건조기 그랑떼!! 그리고 삼성 큐브까지 체험 가능합니다~~ 신청은 요기로! https://www.samsung.com/sec/event/homecare/
2018.10.22. ,[네이버 체험단] 삼성 에어드레서 의류 청정기 체험단...,https://shopping.naver.com/play/stores/100001161/news/2000673798 [네이버 체험단] 삼성 에어드레서 의류 청정기 체험단 모집중 (DF60N8500BG)...
2018.10.22. ,[네이버 체험단] 삼성 에어드레서 의류 청정기 체험단...,https://shopping.naver.com/play/stores/1000022786/news/2000673795 [네이버 체험단] 삼성 에어드레서 의류 청정기 체험단 모집중 (DF60N8700MG)...
2018.10.24. ,[체험단 모집]삼성 에어드레서,삼성 에어드레서 무료체험단 모집(DF60N8700MG) http://naver.me/G51P5Dg8
2018.10.25. ,"삼성안심가전체험단소식(삼성에어드레서,그랑데,삼성큐브)","안심가전체험단을 모집한대요ㅠㅠ 저는 애기키우면서 출근하느라 빨래,다림질 굉장히 스트레스였는데 에어드레서나 그랑데 한번 써보고싶네요 ㅎㅎ....."
2018.10.31. ,미세먼지 안전가전 체험단모집 에어드레서 그랑데 삼성큐브,#삼성에어드레서 #에어드레서 #미세먼지 #안심가전체험단
4일 전 ,#삼성에어드레서 지금까지 이런 드레서는 없었다,만약 체험단에 당첨된다면 내 방 침대도 내 줄 수있음 오시기만 하세요..드레서님..ㅜ #진정한의류청정 #삼성에어드레서 #미세먼지필수템 #인테리어가전 지금까지 이런...
2018.11.02. ,삼성 에어 드레서 실사용 후기 1,에어 드레서 정말 좋을지 살까 말까 고민하는 도중 신청한 체험단에 당첨돼서 체험해본 에어 드레서는 매일 정장 입고 드라이하는 옷이 많은 우리 부부에게는...
2018.11.02. ,에어드레서 실사용후기 2 바지 칼주름?..,에어드레서를 구입하려고 고민했던 이유는 1. 드라이를 안해도 될정도로 정말... 릴레이 체험단을 해보면서 내가 경험을 토대로 저 의문에 답을 하자면 1. 드라이를...
2018.10.31. ,"[삼성 체험단 모집]에어드레서, 그랑데, 삼성큐브","SAMSUNG https://www.samsung.com/sec/event/homecare/ [삼성 체험단 모집]에어드레서, 그랑데, 삼성큐브 삼성에서 체험단 모집한데요 ♡"
2018.10.29. ,삼성에어드레서 체험단모집!,https://local.sec.samsung.com/comLocal/event/promotion/eventPopup.do?eventId=14265&popupNum=1
2018.10.29. ,"[체험단모집]삼성에어드레서, 건조기그랑데, 큐브","[체험단모집] 삼성 에어드레서, 삼성 건조기그랑데, 삼성큐브 삼성큐브 공기청정기 디자인도 깔끔하고 잦은 미세먼지로 창문도 마음껏 열지 못하고 사는데 꼭 필요한..."
5일 전 ,AR카메라로 에어드레서를 배치해 보았다.,#삼성에어드레서 광고를 보는데 화면 아래쪽에서 체험단 모집한다는 글을 봤다. 그래서 삼성 홈페이지에 가서 응모방법을 확인했다. 1. 삼성닷컴 앱에 있는 AR카메라를...
2018.10.26. ,[삼성][안심가전체험단][에어드레서][그랑데][삼성큐브][미세먼지],페이스북에서 우연히 삼성 안심가전 체험단 모집하는 게시물을 보고 공유합니다. https://samsung.com/sec/event/homecare/ 저도 이번 기회에 체험단 신청했어요 당첨되면...
2018.11.22. ,삼성 에어드레서 사용기 : 미세먼지 No! 교복 바지 칼주름,실제로 직접 보고 설명을 들으니 기능이 넘 좋아 이 때부터 에어드레서가 꿈에 나오기까지 하더라구요 :) 제가 미세먼지 안심가전 체험단에 뽑혔다는 전화를 받고도...
2018.10.27. ,삼성에어드레서 체험단 모집,https://www.samsung.com/sec/event/homecare/?cid=kr_banner_naverr_homecare_20181023
2018.10.26. ,삼성 에어드레서 체험단 모집,https://www.samsung.com/sec/event/homecare/
2018.10.31. ,삼성 에어드레서 체험단모집,
2018.10.30. ,"삼성 건조기 그랑데 , 에어드레서 , 큐브 안심가전체험단...",#삼성건조기그랑데 #안심가전체험단 모집중이에요~!! ↑↑↑ 사진을 누르시면 신청페이지로 이동합니다.↑↑↑
2018.10.24. ,안심가전 에어드레서 그랑데건조기 삼성큐브 체험단 응모♡,https://www.samsung.com/sec/event/homecare/?cid=kr_banner_naverb_homecare_20181023 #삼성 #미세먼지안심가전 #에어드레서 #그랑데 #건조기 #삼성큐브...
2018.10.28. ,삼성 에어드레서 체험단,
2019.02.08. ,삼성 에어드레서 리뷰어 체험단!!,https://www.samsung.com/sec/event/2019_airdresser/?cid=sec_social_facebook_airdresser_20190201_fashion_mobile
2018.10.08. ,없으면 안돼! 신혼가전 추천합니다 / 삼성 에어드레서,"우리 곧 다시 만날 수 있겠지?? 여보, 돈 많이 벌어와 ^^ 태그 본 포스팅은 삼성 '에어드레서 릴레이 체험단'으로 일주일 제품 대여 체험 후기 입니다."
2018.11.04. ,미세먼지 걱정끝!삼성에어드레서,위의 사진들은 삼성 홈페이지에서 가지고왔어요~! 더욱 더 자세한 사항은 삼성홈페이지에 들러서 확인해주세요 #네이버체험단 #DF60N8700MG #삼성에어드레서 #의류청정기
2018.12.22. ,의류청정기 추천 삼성 에어드레서 그 특별함 쓸수록 반하는중 ♡,4단계 의류 청정 방식 삼성 에어드레서 ━━━━━━━━━━━━━━━━━━━━ #의류청정기 #의류청정기추천 #안심가전체험단 제트에어와 안감케어...
2018.10.24. ,[정보공유]삼성에어드레서 체험단모집,http://naver.me/GciKmRDP
2018.10.30. ,"미세먼지 안심가전(에어드레서, 그랑데, 삼성큐브) 체험단 모집",오메 작금 같은 시대에 없어서는 안될 #진리템 #인생템 #필수템 여기 다 있네! ^-^ 삼성에서 미세먼지 안심가전 체험단 모집하네요! 다들 응모 고고!
2018.10.04. ,의류 청정 시대를 열다! / 삼성 에어드레서,사용해 보고 할 예정이니 관심있게 지켜봐주시고' 좋아요' 많이 눌러주세요 ^^ 본 포스팅은 삼성 '에어드레서 릴레이 체험단'으로 일주일 제품 대여 체험 후기 입니다.
2018.10.29. ,삼성 미세먼지 솔루션 에어드레서 체험단 모집,
2018.10.24. ,[미세먼지 안심가전] 삼성 에어드레서 / 삼성 그랑데 / 삼성 큐브,에어드레서 체험단 신청!! 꼭 당첨됐음 좋겠어요 #삼성에어드레서 #에어드레서 #미세먼지 #안심가전체험단 #삼성건조기그랑데 #그랑데 #삼성큐브 #삼성공기청정기
2018.12.13. ,삼성 에어드레서 의류청정기 스페셜코스로 더 스페셜한...,4단계 의류 청정 방식 삼성 에어드레서 ━━━━━━━━━━━━━━━━━━━━ #안심가전체험단 #의류청정기 #의류청정기추천 시크한애미' HOUSE 에 오신걸...
2018.10.26. ,삼성 큐브 그랑데에어드레서 득템찬스,후 꼭 신청하셔서 같이 3종세트 득템해요! #삼성에어드레서 #에어드레서 #미세먼지 #삼성건조기그랑데 #그랑데 #삼성큐브 #삼성공기청정기 #안심가전체험단 #삼성 #득템
2018.10.31. ,삼성 에어드레서 미세먼지 안심가전 체험단,삼성 에어드레서 미세먼지 안심가전 체험단 https://www.samsung.com/sec/event/homecare/
2018.10.29. ,에어드레서 그랑데 삼성큐브까지 너무 탐이 나요 ~,의류청정기인 #진리템 #삼성에어드레서 #의류청정기 와 이젠 신혼살림... 안심가전 체험단을 모집한답니다. 출처 : https://www.samsung.com 예전에는 집안의 공기도...
2018.10.30. ,삼성 에어드레서_미세먼지 안심가전 체험모집,먼저 체험단 참여해보라구 알려주었답니다. 타사랑 비교해 삼성 에어드레서가 더 더 많이 좋다고 하는 점은 1. 사용할때 마다 먼지를 털지 않아도 되는 점 2. 문 닫힌...
2018.09.12. ,[삼성전자] 【#삼성_에어드레서 X #집꾸미기 릴레이 체험단...,"[체험단 모음][삼성전자] 【#삼성_에어드레서 X #집꾸미기 릴레이 체험단 40인… (2018-09-12 09:58:35) 삼성_에어드레서,집꾸미기,에어드레서 LINK 더 많은..."
2019.02.11. ,"삼성 무선 청소기, 삼성제트 체험단 모집중!...",삼성제트 지원해요 :) 안녕 유지니에요 :) 요즘 에어컨부터 에어드레서... 마침 체험단을 모집하더라구요~? +_+ 이름하여 #제트200인소비자인증단 2019삼성무선청소기...
2018.10.31. ,삼성전자 미세먼지 안심가전 체험단 모집_에어드레서,삼성전자 미세먼지 안심가전 체험단을 모집한다!! 겨울에도 미세먼지에 대한... 요즘 같은 겨울에!!!! 정말 정말 필요한 체험단!!!!!! 콩콩이네가 한 번 해보겠습니다!!!!!!
2018.11.03. ,네이버 쇼핑] 삼성 에어드레서 우드 브라운 무료체험단 모집...,우드 브라운 무료체험단 모집 이벤트 https://shopping.naver.com/play/stores/100001161/news/2000673798 #네이버체험단 DF60N8500BG 삼성에어드레서 의류청정기
2018.10.28. ,#삼성 에어드레서 #삼성 큐브공기청정기 #삼성 그랑데건조기,"안심가전 #삼성 에어드레서#삼성 큐브공기청정기#삼성 그랑데건조기 나에게... 다양한 제품 체험하고 후기남기는게 취미인데,안심가전체험단으로 활동하며 고화질의..."
2018.10.31. ,삼성 미세먼지 안심가전 체험단 지금 만나러 갑니다~,"세계 최대 가전회사 삼성전자에서 미세먼지 안심가전 체험단을 모집하고 있습니다. 이 시대를 살아가는 모든 이의 인생템이 되어 줄 삼성에어드레서, 건조기..."
2018.10.31. ,미세먼지 안심가전 체험단 삼성 에어드레서 #진리템...,삼성 에어드레서 #진리템 삼성건조기그랑데 #인생템 삼성큐브#필수템
2018.12.02. ,삼성 건조기 그랑데 16kg 체험단 모집을 한다니!!,거실에 에어드레서 옆에 두고 같이 의류관리하면 좋을듯 참!! 일단 체험단에 신청하기 전에 나는 삼성 건조기 그랑데에 먼저 알아보기도 했음 ㅋㅋㅋ 궁금한건...
2019.02.08. ,삼성제트 무선 청소기 체험단 200인 모집,com 삼성에서 무선 청소기 제트 체험단 모집을 하고 있습니다. 이것 외에도 무풍 에어컨과 에어드레서 체험단을 모집하는것 같지만 저희집은 일단...
2018.10.27. ,삼성에서 #에어드레서#그랑데#삼성큐브 체험단모집합니다~!!,코훌쩍훌쩍 체험단신청합니다 될지안될지 몰라두 기대해봅니다 여러가전에서... 그랑데 #삼성건조기그랑데#그랑데#미세먼지#안심가전체험단 링크는 아래 공유합니다...
2018.10.15. ,"삼성 에어드레서 , 의류청정기 의류관리기 추천할 수 밖에 없는...",세상에 없던 라이프스타일 누려봅니다 ♩ 삼성 에어드레서 더 자세히 알아보기 https://www.samsung.com/sec/airdresser 본 게시물은 릴레이 체험단 선정으로 제품을 대여 받아...
2018.10.25. ,"삼성안심가전체험단 (그랑데,에어드레서,삼성큐브) 모집합니다!",안심가전체험단을 모집하기 때문이죠!!!! 바로 이건데요 요새 곧 태어날 2세를 위해서도 겸사겸사 봐두고 있던 물품이 있는데 그랑데건조기에 눈이 똭!! 체험단을...
2018.10.31. ,삼성 에어드레서:그랑데:큐브 체험단 모집!!:),미세먼지 안심가전 체험단 모집 | 삼성닷컴
2018.12.05. ,의류청정기 추천!삼성 에어드레서 제트에어와 안감케어 보다...,4단계 의류 청정 방식 삼성 에어드레서 ━━━━━━━━━━━━━━━━━━━━ #삼성에어드레서 #의류청정기 #안심가전체험단 우리집의 의류청정이 시작 된 후...
2018.10.29. ,삼성 에어드레서 건조기 그랑데 큐브체험단 신청하세요^^,"체험단을 하게되어 신청하게 되었답니다. 요즘 살까말까.고민중인 건조기 체험단신청을 받는다는걸 알게되었네요. 삼성전자제품이죠, 그래두..."
2018.11.04. ,#네이버체험단 #DF60N8500BG #삼성에어드레서 #의류청정기,사용하고.생동감 넘치는 후기 들어갈께요~ #네이버체험단#DF60N8500BG#삼성에어드레서#
2019.01.31. ,삼성 2019년 NEW 무풍에어컨 무풍갤러리 체험단 모집,삼성 2019년 NEW 무풍에어컨 무풍갤러리 체험단 모집 색다른 디자인 그리고 이제껏... 삼성 에어드레서 같은 느낌이 들긴하는데 훨씬 고급스럽고 품격있는 이미지를...
2018.12.13. ,에어드레서 릴레이 체험단 우수후기!,
2018.10.29. ,삼성 에어드레서,#삼성에어드레서 #에어드레서 #미세먼지 #안심가전체험단 https://m.facebook.com/story.php?story_fbid=1775761512551410&id=144295415698036
2018.10.28. ,삼성 에어드레서 상섬 건조기 그랑데 삼성 큐브 체험단 모집...,https://www.samsung.com/sec/event/homecare/?cid=kr_banner_naverb_homecare_20181023
2018.10.31. ,에어드레서 안심체험단 신청합시다.,https://www.samsung.com/sec/event/homecare/ 미세먼지가 많은 요즘 이가전들이 필수이지 않나 싶내요. 전 마지막날 신청하지만 신청하신 모든분들 행운이...
2018.10.28. ,에어드레서 사러가자!!!,기비생각보다 떨림도 있어서 미뤄두다 나름 초코가 또하나의가족이기에 초코 가자 #삼성에어드레서 #에어드레서 #미세먼지 #생일선물 #와이프생일선물 #안심가전체험단
2018.12.07. ,에어드레서 리얼 후기,#에어드레서 #삼성의류청정기 #써보면진리템 #탐나는에어드레서 에어드레서 릴레이 체험단 우수후기 잘 봤어요
2018.10.25. ,내돈 주고 직접 구매한 진짜 #삼성에어드레서 후기!!!!,"ㅜㅜ ,HAHAHAHAHA!!!!!!!!! 체험단 아니고 내돈주고 직접 산 후기! 추후에 사용기도 올려야겠다 ㅎㅎ #삼성의류청정기 #삼성에어드레서 #삼성닷컴이벤트"
2018.10.31. ,"삼성 에어드레서, 건조기 그랑데, 삼성큐브 미세먼지 해결템","삼성 에어드레서, 삼성 건조기 그랑데, 삼성큐브 3가지 미세먼지 안심가전으로 걱정을 덜어보아요 지금 안심가전 3종세트 체험단 모집 중! 저도 정말 갖고싶은..."
2019.02.07. ,2019년 NEW 무풍에어컨 삼성 무풍 갤러리 체험단 모집,에어드레서 이후에 또 삼성에서 새로운 성능 및 디자인을 겸비한 2019년 NEW 무풍에어컨을 발표했답니다. 새롭게 태어난 무풍에어컨 체험단을 모집하고 있으니...
2018.10.30. ,삼성전자] 미세먼지 안심가전 체험단 이벤트 - 삼성 에어드레서...,"https://www.samsung.com/sec/event/homecare/ 삼성전자] 미세먼지 안심가전 체험단 이벤트 - 삼성 에어드레서, 삼성 건조기 그랑데, 삼성 큐브"
2018.10.22. ,삼성 에어드레서 무료 체험단 및 특별 혜택에 도전해 보세요~,“본 컨텐츠는 삼성전자 제공으로 회산에서 제작하였습니다.” 체험단 신청하러 가기 https://shopping.naver.com/play/stores/100001161/news/2000673798
2018.10.27. ,삼성 에어드레서 어떨까?,삼성 에어드레서에 대한 소개를 해보겠습니다!! #진리템 으로 불리는 그... cid=kr_banner_naverbsp_homecare_airdresser_20181023 미세먼지 안심가전 체험단을...
2018.12.19. ,에어드레서 리얼 후기,40인 릴레이 체험단이 직접 사용해본 에어드레서!! 에어드레서 리얼 후기 #에어드레서 #삼성의류청정기 #써보면진리템 #탐나는에어드레서
