날짜,제목,본문요약본
20시간 전 ,신혼부부 로망템 삼성 에어드레서 체험단 마지막날!,삼성에어드레서 체험단으로 선정되기 위해서는 다음과 같은 방법대로 신청을 해야해요. 안드로이드 사용자는 삼성닷컴 앱에 있는 AR기능으로 에어드레서를 놓고 싶은...
2019.02.08. ,[삼성 에어드레서] 체험단 신청합니다. (신청 방법 첨부),"에어드레서 리뷰어 신청 의류 셀프 관리에 과심이 생겨 삼성 에어드레서 체험단에... 이에 삼성의 최신 에어드레서에 관심이 생겼고, 체험단을 신청해 보고자 한다. 기계..."
2일 전 ,현실30대부부의 의류청정기 #삼성에어드레서 체험단 응모!,하지만 에어드레서가 있으면 “내 남편의 주름 걱정 덜어주는 내조녀” 가 될수 있지 않을까!!? 아주 아주 간절하게.. 이 체험단에 선정되길 기대 해 봅니다. *_* 추가...
6일 전 ,격하게 갖고싶다 너란 삼성 에어드레서 (삼성에어드레서 체험단...,열어보는 에어드레서...체험단을 한다고 하니 좀 기다리라는 남편앞에서 어깨를... 나에게도 에어드레서를 내려주것지 어쨌거나 삼성 에어드레서 체험단 신청하러...
5일 전 ,"삼성 에어드레서 체험단 , 미세먼지 필수템이쥬!!",진정한의류청정 삼성 에어드레서 요즘엔 공기가 너무 안좋기 때문에... 삼성 에어드레서 체험단은 지금 현재 2차 리뷰어 신청 가능하답니다. 2019년 2월 11(월) - 2019년 2월...
12시간 전 ,삼성 에어드레서 체험단 도전! - 태어날 아가를 위한 신혼집...,"삼성 에어드레서 체험단 도전! 이제 머잖아 태어날 아가를 위해 이것저것... 그런데 삼성 에어드레서 검색하다가 우연히 체험단 모집 광고를 보게 되었는데 헐, 오늘이..."
2019.02.11. ,[삼성 에어드레서 체험단] 진정한 의류 청정을 꿈꾼다면...,"[삼성 에어드레서 체험단] 진정한 의류 청정을 꿈꾼다면, 미세먼지 필수템! 신청해... 삼성 에어드레서 리뷰어 모집 도전! 체험단 선정되면 동생이랑 공용으로 사용하는..."
4일 전 ,삼성 에어드레서 아이 키우는 집엔 필수 체험단 모집,삼성 에어드레서 아이 키우는 집엔 필수 체험단 모집 요즘 같은 시기에 꼭 필요한... 필요하신분 아래 링크를 통해 지원해보세요. 삼성 에어드레서 체험단 바로 가기
7일 전 ,우리가족 의류 프로텍터 삼성에어드레서 체험단 신청합니다^^,삼성에어드레서를 배치할 공간을 촬영하여 첨부해야한다. 삼성에어드레서 체험단 신청방법 ( 출처 : 삼성닷컴 ) 체험단 신청방법에 대하여 좀 더 자세하게 설명하면...
2019.02.10. ,삼성 에어드레서 의류관리기 매력있네 / 리뷰어(체험단) 모집 소식,소개 영상을 올리면서 마무리하도록 하겠습니다. 그럼 여기까지 삼성 에어드레서 소개 및 리뷰어(체험단) 모집 소식이었습니다. 모두 화이팅입니다~~~ 좋은 하루 되세요~~
14시간 전 ,"삼성에어드레서 체험단 신청, plz! 그리고 유후네 안방도 살짝...","에어드레서 격하게 갖고 싶은 삼성 에어드레서 체험단 신청 방법입니다. 1차와 2차를 나눠서 당첨자를 뽑기에 바늘 구멍에 들어가는 것 보다 더 어렵겠지만, 누구보다..."
2019.02.08. ,우리집 옷 지킴이:: 삼성에어드레서 체험단 신청!!,#삼성에어드레서 #삼성전자 #미세먼지필수템 #삼성에어드레서체험단 #인테리어가전 #에어드레서체험단 #삼성체험단 #삼성체험단신청 #삼성에어드레서장점...
12시간 전 ,#진정한의류청정 #삼성에어드레서 체험단 오늘까지 신청해요 :),요 삼성 에어드레서 체험단을 모집한다고 해서 소개해드리려고 하는데요 1차는... 삼성 에어드레서 !! 체험단 어떻게 신청하는지 알려드릴게요 :) 앱 다운받으셔서 놓고...
2일 전 ,삼성에어드레서 체험단 막차타고 신청해봅니다.,좋은 제품들 체험단이 어마어마하게 쏟아지네요. 그런즉슨 가만히 있을 순 없다.... 삼성에어드레서였어요. 가서 작동하는거 보고 요거 너무 좋으다 좋아라면서 손으로...
2019.02.10. ,삼성에어드레서 진정한 의류청정 체험단,"의류들에게도 에어드레서가 반드시 필요한 이유가 있어요. 그래서 삼성에서 공식 리뷰어인 체험단을 모집하게 됐습니다. 2019. 2. 1~ 2019. 2. 20일까지 1차, 2차 나누어..."
2019.02.11. ,삼성에어드레서 체험단 신청하기 .!,"삼성에어드레서 체험단 소식이 있어서 포스팅합니다 :) 인테리어 가전으로도 알려진 삼성에어드레서 공간도 많이 차지하지 않고, 디자인도 이뻐서 여러모로 탐나는..."
2019.02.12. ,삼성 에어드레서 체험단 모집 / 함께 참여해요 :),"삼성 에어드레서 체험단 (리뷰어) 모집 예전에는 크게 신경도 안 썼지만, 아이를... 공기청정기만큼 어느새인가 에어드레서도 미세먼지가 많은 요즘 시대에 꼭 필요한..."
2019.02.06. ,"미세먼지 필수템 삼성 에어드레서 리뷰어모집, 체험단 응모",고민하다가 에어컨 구입시 함께 장만하려고 보류중이었는데.. 또 반가운 체험단... 삼성 에어드레서 체험단 / 리뷰어 신청은 아래 링크를 클릭 삼성 에어드레서 리뷰어...
2019.02.10. ,미세먼지 필수템 삼성에어드레서 리뷰어(체험단),삼성에서 출시한 의류 관리 가전인 에어드레서! 에어드레서 체험단 모집 한다고 하네요. 두근두근! 미세먼지 많은 요즘 외출하고 들어오면 아기가 있는 집이라...
3일 전 ,#삼성에어드레서 체험단 신청,"나도나도 갖고싶다는 생각이 드릉드릉, 그렇게 에어드레서 체험단에 도전해 봄. 매일매일 정장을 입는 남편+비지니스 캐쥬얼을 입는 나에겐 강같은 에어드레서...."
2018.10.30. ,삼성 에어드레서 체험단 신청 안할수가 없네!!,"삼성 에어드레서 체험단 모집 정보임 정확히 따지면 미세먼지 안심가전 체험단을 모집중이라고 함 삼성 에어드레서, 건조기 그랑데, 큐브 이렇게 3가지인데 나는..."
어제 ,#삼성에어드레서 체험단 도전! 오늘 마감이니 서두르세요!,반갑게도 삼성 에어드레서 리뷰어(체험단) 모집을 하고 있어서 도전해봅니다! https://www.samsung.com/sec/event/2019_airdresser/?cid=sec_social_instagram_airdresser_20190201_fashion_mobile...
4일 전 ,삼성 에어드레서 체험단 리뷰어 모집 저도 신청해보아요.,삼성 에어드레서도 만나볼수 있는 행운이 오길 기대해 보네욤... 더 늦기전에 얼른얼른 고고씽~~ 이웃님들도 함께 도전해 보세요...^^* 이글은 삼성 에어드레서 체험단...
3일 전 ,의류관리기 삼성 에어드레서 체험단 신청하고 당첨되세요,"삼성에어드레서 체험단을 뽑는다는 나에게는 아주 절호의 찬스가 생겨서... 구매해서 에어드레서도 동일한 브랜드로 갖고 싶고, AR 모드로 촬영해보니 우드..."
13시간 전 ,미세먼지필수템 삼성에어드레서 체험단 모집,"*미세먼지필수품* 삼성에어드레서 체험단 모집 요즘 신혼 가전 필수품 중 하나인 삼성에어드레서! 저도 얼마 전 이사하면서 웬만한 가구, 가전들은 신혼 때 샀던..."
2019.02.12. ,삼성 에어드레서 체험단 모집 중 신혼집 로망템!,다음주 수요일까지 에어드레스 체험단 모집~ 미세먼지도 가득한 요즘 의류청정 필수에요! 신혼집에 로망템으로 삼성 에어드레서 꼬옥~ 선정되서 사용하고 리뷰도...
2019.02.10. ,삼성 에어드레서 체험단 모집 소식! 리뷰어 신청해보세요,오늘 내가 체험단 신청할 삼성에어드레서도 그런 가전 중 하나다. 특히 깜끔할을... www.samsung.com 삼성에어드레서 체험단 이번 겨울 동안 미세먼지가 많은 날에는...
16시간 전 ,미세먼지 날려버릴 삼성 에어드레서 체험단 모집해요,"그런데 삼성 에어드레서 체험단 모집을 한다고 해서 진지하게 궁서체로, 체험단... 모두모두 체험단 신청해봐요 :) 삼성 에어드레서 리뷰어 모집 | 삼성닷컴 삼성..."
2019.02.13. ,삼성 에어드레서 리뷰어 체험단 신청 방법,"삼성 에어드레서 리뷰어 체험단 신청방법 1) 에어드레서를 놓고 싶은 공간을 촬영 2) sns, 블로그, 카페에 공유 3) 공유한 URL과 제품을 갖고 싶은 이유 작성 4) https..."
6일 전 ,삼성 에어드레서 체험단 모집(~2/20),체험단 모집은 여기에서! #진정한의류청정 #삼성에어드레서 #미세먼지필수템 #인테리어가전 https://www.samsung.com/sec/event/2019_airdresser/ 삼성 에어드레서 리뷰어...
2018.10.30. ,삼성 에어드레서/ 그랑데/ 삼성큐브 체험단 내.꼬하자★,삼성 에어드레서/ 그랑데/ 삼성큐브 체험단 내.꼬하자★ 완전 핫.핫.핫한 소식을 들고 왔어요!!!! 이걸 알고나서는 어찌나 기쁘던지 이 기쁜마음을 혼자알기엔 너무...
14시간 전 ,[삼성에어드레서] 삼성에어드레서 삼성에어체험단 신청합니다,"[삼성에어드레서] 삼성에어드레서 체험단 신청합니다 삼성에어드레서를 놓고싶은 공간촬영해서 나의블로그,SNS카페에 공유해요 공유한 URL과 제품을 갖고싶은이유를..."
13시간 전 ,삼성 에어드레서 체험단 모집 (2019.2.11~2.20),요즘 미세먼지필수템 삼성 에어드레서 체험단 소식이 있어서 알려드려요... 하지만 에어드레서 하나로 걱정 뚝.....! 털어낸 먼지와 냄새까지 잡아주는 필터로 더...
2019.02.08. ,삼성 에어드레서 리뷰어 (체험단) 신청 !,설 연휴 티비를 보다가 우연히 #삼성에어드레서리뷰어 (체험단)을 모집한다는 광고... 삼성에어드레서 #미세먼지필수템 #인테리어가전 #삼성에어드레서체험단...
2019.02.10. ,삼성 에어드레서 소개 및 체험단 안내,삼성 에어드레서의 체험단을 현재 삼성 공식 홈페이지에서 진행을 하고 있으며 총 10명에게 에어드레서를 체험할 수 있는 기회를 주는 행사를 하고 있습니다....
12시간 전 ,인테리어가전 삼성에어드레서 체험단 신청합니다,다양한 기능 알차게 체험하고 생생한 체험기도 포스팅으로 올리고 삼성 에어드레서 체험단 지원합니다. #삼성에어드레서 #진정한의류청정 #미세먼지필수템...
2019.02.09. ,삼성에어드레서 #미세먼지필수템 #인테리어가전 체험단 리뷰어...,블로거라면 체험단에 아래 클릭하여 #삼성에어드레서 체험단에 참여 하세요~~^^ 제주에서 책쓰는 플로리스트 이해원 작가였습니당~~^^ 삼성 에어드레서 리뷰어 모집...
4일 전 ,삼성에어드레서 체험단 신청!!우리집에도 왔으면 좋겠어요!!,"삼성에어드레서 체험단 신청!!우리집에도 왔으면 좋겠어요!! 마트에서 발견한... 삼성 에어드레서가 우리집에 온다면 정말 기분이 좋을것같아요, 삼성 에어드레서가..."
2019.02.10. ,"신생아 필수템 삼성에어드레서 / 리뷰어 모집, 체험단 신청",임신 전부터 계속 관심을 가졌었던 에어드레서 시어머니 가전제품 보러 갔다가 기다리는 동안 에어드레서로 옷을 깔끔하게 해주셨었는데 그때부터 에어드레서 노래를...
2일 전 ,"""삼성 에어드레서"" 우리집 필수 가전제품!! 체험단을 신청합니다~",체험단 이벤트 광고가 내 눈에 떡하니 보이니 체험단 신청을 안할 수는 없지 아니한가!!! ^^ 삼성 에어드레서 리뷰어 모집 기간이 2019.02.01(금) ~ 2019.02.10(일)일 까지...
3일 전 ,#삼성에어드레서 체험단 신청,"TV를 보다가 #삼성에어드레서 광고 하단에 체험단을 모집한다고 해서, 어차피 안되겠지만 신청서를 적어보기로 했습니다. ㅎ 아직 나도 해보고 싶은데 어디서 해야 될지..."
21시간 전 ,[기타 리뷰] 삼성에어드레서 체험단 신청,삼성에어드레서 체험단신청을 알려드리려고 해요 :) 체험단 신청은 오늘까지니까... 그 다음 AR기능을 사용해서 삼성에어드레서를 놓을 자리를 보고 사진을 찍어주세요...
2019.02.08. ,삼성에어드레서 체험단 모집중!,"단 25분만에 미세먼지 99%이상 털어주는 에어드레서, 이것이 진정한 의류청정 아닌가요!! 아래 배너를 클릭하면 체험단 신청 페이지로 이동해요. 그럼 전 발표일을..."
18시간 전 ,#삼성에어드레서 리뷰어 체험단 모집 [공유],"근데 때마침 오늘까지인 체험단 모집을 발견하고, 확률은 매우 적은데 괜히 두근두근 되더라구요ㅋㅋ 삼성에어드레서 리뷰어 모집 삼성에어드레서를 놓고싶은 공간..."
2018.10.30. ,"삼성 에어드레서, 그랑데, 큐브 체험단 모집 :)",포기했던 에어드레서 체험단 모집 소식을 발견 -! 삼성 에어드레서 뿐만 아니라 건조기 그랑데 공기청정기 큐브까지 체험단을 모집하고 있다 우리집도 미세먼지 걱정에...
12시간 전 ,나의 로망템 :: 삼성 에어드레서 체험단 리뷰어 신청,주부의 로망템 삼성 에어드레서 리뷰어 신청 살림 하는 사람이라면 누구나 꿈꾸는 삼성 에어드레서를 집에 격하게 꼭! 들여놓고싶다 #미세먼지필수템 #인테리어가전...
2018.10.31. ,"삼성 에어드레서, 그랑데 건조기, 삼성큐브 공기청정기 체험단...",삼성 안심가전 체험단 모집 안녕하세요 해피나나에용 :) 곧 첨단 대라수로 이사... 삼성에어드레서 체험단 응모 하자! ▶ 에어드레서 신청서 바로가기 ▶ 에어드레서...
7일 전 ,미세먼지 필수템! [삼성 에어드레서 체험단 모집] 신청하기,#진정한의류청정 #삼성에어드레서 #미세먼지필수템 #인테리어가전 요즘 같은... (결국 후회중ㅋㅋㅋㅋㅋㅋㅋㅋㅋㅋㅋㅋ) 그러던중 삼성 에어드레서 체험단을...
12시간 전 ,삼성 에어드레서 체험단,세련된 에어드레서 어느곳에놔도 인테리어 효과 광고보고 검색해서 알게된 에어드레서 체험단! 2차리뷰어 당첨! 이라면 냄새 먼지 다빠지고 뽀송한 옷을 입고 열씸...
2019.02.08. ,에어드레서 리뷰어 모집(체험단),그러던중 남편이 적극 추천한 에어드레서 체험단 신청하는 피드가 딱 보이더라구요... 활동기간도 길지않아서 에어드레서 사용하면서 후기나 좋은점들 하나씩만 피드를...
2019.02.11. ,삼성에어드레서 리뷰어 모집 소식이예요 !! (체험단모집),"""매럭적인 그이름 삼성에어드레서 "" 미세먼지 라면 지긋지긋 ㅠㅠ 그러다 알게된 의류청정기 너무너무 가지고 싶어용 ㅠㅠㅠ 그런데 이번에 삼성에어드레서 리뷰어 모집..."
2019.02.10. ,삼성에어드레서 [미세먼지 필수템] 체험단 신청해요,삼성에어드레서 [미세먼지 필수템] 체험단 신청해요 콜록콜록 하루걸러 미세먼지에 황사에.. 정말이지 건강도 건강이지만 옷에 묻어나는 이물질들 때문에 찜찜한...
2일 전 ,언제나 새 옷 처럼 [삼성에어드레서] 체험단 신청,* 체험단 신청방법 #진정한의류청정 #삼성에어드레서 #미세먼지필수템 #인테리어가전 #삼성에어드레서체험단 #삼성에어드레서리뷰어 #삼성에어드레서리뷰어신청방법...
2일 전 ,미세먼지 필수템 삼성 에어드레서 리뷰어 체험단 2차 모집,"체험단 응모 이것이 진정한 의류청정삼성 에어드레서봄,여름 본격 미세먼지의 계절이 돌아온다. ㅜㅜ한국에서 처음으로 ... m.blog.naver.com 에어드레서 체험단..."
2019.02.10. ,삼성 에어드레서 체험단 신청!,바로 #삼성에어드레서 미세먼지 필터뿐만 아니라 냄새분해 필터까지 장착된 스마트한 제품이다. 제트에어로 겉감 안감 모두를 케어해주는 삼성 에어드레서!...
6일 전 ,삼성 에어드레서<체험단> : 이것이 우리집건강지킴이,www.samsung.com #진정한의류청정 #삼성에어드레서 #미세먼지필수템 #인테리어가전 #미세먼지에어드레서 #삼성 #삼성전자 #일상 #아버지선물 #삼성에드레서체험단
2018.10.26. ,"삼성 안심가전체험단@ 에어드레서, 그랑데, 삼성큐브","안심가전체험단을 진행하고 있어요! 삼성 에어드레서, 삼성 건조기 그랑데... 제품 3종 ALL체험단 3명 삼성 에어드레서 체험단 10명 삼성 건조기 그랑데 체험단 10명..."
2019.02.12. ,삼성 에어드레서가 체험단을 모집한대요~~,삼성에어드레서로 핵인싸되고 싶네용 ㅋㅋ 체험단에 선정 되시면 다름과 같은 리뷰어 활동을 해 주셔야 합니다. 삼성에어드레서 체험단이 된다면 어떤 색상이든...
2019.02.13. ,삼성에어드레서체험단모집 중,#삼성에어드레서 #깨끗한옷 #상쾌해요 #미세먼지필수템 #인테리어가전... 체험단 소식은 OLLEH!!! 외출 후 공기청정기 옆을 지나가면 열일하는 공기청정기. 그만큼 외출...
2018.10.30. ,삼성 에어드레서/ 그랑데 건조기/ 삼성큐브 체험단 모집해요!,삼성에서 에어드레서/ 그랑데 건조기/ 삼성큐브 체험단을 모집한다고 해요~ 3가지 모두 정말 필요한 가전제품이죠?! 미세먼지 안심가전 체험단 모집!! 10.23~10.31 까지...
2일 전 ,넘 탐나는 삼성 에어드레서 리뷰어 체험단 도전합니다!,#진정한의류청정 만약 삼성 에어드레서 리뷰어 체험단에 뽑힌다면 거실에 있는 삼성 에어컨 바로 옆에 놓고 사용하고 싶어요. 매일 집에 들어올 때마다 삼성 에어컨의...
17시간 전 ,삼성 에어드레서 체험단? 나 필요해요,삼성 에어드레서 리뷰어 모집 2019.02.01 ~ 2019.02.20 삼성 에어드레서 체험단 모집... 꿈의 '삼성 에어드레서'를 집에 들이지 못하고 있었다. 하지만 체험단 모집이라니??? 못...
12시간 전 ,삼성 에어드레서 체험단에 도전합니다. (성공하면 책 좋아하는...,"삼성 에어드레서 체험단이라니...!! 검색하니, 마감이 오늘. 두둥. 아이를 재우고 이... 체험단 응모하려면 에어드레서를 어디에 둘 것인지 정해야한다고 합니다. 그래서..."
2019.02.09. ,삼성에어드레서체험단모집,삼성 에어드레서 체험단 모집??? 리! 얼! 리? 대박대박 신청해야지요 안되더라도 이기회에 에어드레서도 더 관심깊게 볼수있는 시간였네용 저는 이사갈 예정이라서 일단...
2018.10.31. ,삼성 에어드레서 체험단이 떴네요. 함께 건조기 그랑데...,와 대박 체험단이 떴네요 . 이번에 삼성 에어드레서가 출시되서 안그래도 핫하던데요 . 갤러리아 백화점가서 보고 진짜 넘나 갖고 싶더라구요 ^_^ 다른 것 보다 겨울...
2019.02.10. ,삼성 에어드레서 체험단 신청,#진정한의류청정 #삼성에어드레서 #미세먼지필수템 #인테리어가전 #에어드레서 #삼성에어드레서체험단 #삼성체험단신청 #삼성스마트가전...
2019.02.10. ,삼성 에어드레서로 미세먼지 타파! (체험단 모집중),www.samsung.com #삼성에어드레서 #삼성에어드레서체험단 #진정한의류청정 #미세먼지필수템 #인테리어가전 #대박체험단 #삼성체험단
어제 ,삼성 에어 드레서 체험단 신청합니다.,치우고 에어드레서를 저자리에 꼭 꼮꼬꼬꼬꼮! !!!!!!!!!!! 놓고 싶습니다. 아직 돈을 벌 나이가 아니라 공부를 하는게 더 위주인 고3학생이라 체험단에 꼭 당첨됐으면...
21시간 전 ,#삼성에어드레서 체험단 리뷰어 응모하기!,"저희집의류 셀프 관리의 대명사 삼성 에어드레서 사용해보고 싶었는데, 체험단을 모집하고 있어서 응모해보려고 합니다. >_< 응모는 오늘이 마지막 인데요..."
2019.02.08. ,삼성전자 #에어드레서 체험단 모집~~!!,라는 생각에 에어드레서 체험단에 응모하게 되었다.ㅇㅅㅇ 현대사회 필수템!! 삼성 에어드레서!!!!! (갖고싶다...) 이벤트 참여 방법으로는 아래 링크로...
2019.02.13. ,[체험단모집] 삼성 에어드레서 이것이 진정한 의류 청정 총...,blog.naver.com #진정한의류청정 #삼성에어드레서 #미세먼지필수템 #인테리어가전 #삼성 #에어드레서 #체험단 #서포터즈 #체험단모집 #서포터즈모집 #리뷰어
2019.02.02. ,삼성전자 #삼성에어드레서 체험단 모집,삼성전자 에어드레서 체험단 모집을 보고 이거다!!!ㅇㅅㅇ 하면서 삼성전자 홈페이지 를 방문했는데요 지금 부터 체험단 응모방법 안내 해 드릴게요!!~~ 우선 에어드레서...
5일 전 ,삼성에어드레서 체험단모집,삼성에서 체험단을 엄청 모집 하네요~ 컬러도 3가지 색상이나 되고 아이들이 있는 집은 꼭 필수 템 같아요~ 다들 신청해 보세요^^ #진정한의류청정 #삼성에어드레서...
2일 전 ,삼성 에어드레서 체험단 모집 안내 !!!,그래서 이 기회에 체험단에 선정이 돼서 직접 사용해보면 좋을 것 같아... * 삼성 에어드레서 체험단 링크 삼성 에어드레서 리뷰어 모집 | 삼성닷컴 삼성 에어드레서를...
2019.02.11. ,삼성에어드레서 체험단모집,"넘나 갖고싶은것 미세먼지 가득한요즘, 에어드레서도 육아템이라면서요? 큰아이옷 매일빨지도 못하고 , 둘째는 한참 촙촙촙 빨아댈떼라 쉽게 빨지 못하는 아기띠 인형..."
13시간 전 ,"인테리어가전 로망템, 삼성 에어드레서를 집에 들이고 싶다!",3')/ #진정한의류청정 #로망템 #인테리어가전 #삼성에어드레서 우리 집에 와주라주!! 그럼 전 이만 총총☆ 본 포스팅은 #삼성에어드레서 체험단 지원을 위해 작성했습니다.
2019.02.10. ,삼성 에어드레서 체험단 신청 _ 우리집 #로망템 #필수템,"정말 항상 침흘리며 바라보던 #삼성에어드레서 가 체험단 모집을 하고있어요. 2월10일까지 1차 체험단 모집이며, 2월11일부터 2월20일까지 한데요. 저희신랑은..."
2018.10.31. ,#삼성 #에어드레서 #그랑데 #삼성큐브 체험단모집!!!,다씻고 옷 다벗고 아기만져야한다고 신신당부중인데 ㅋㅋㅋ 아마 이게된다면 얼마나 좋아할까 크으 #삼성에어드레서 #에어드레서 #미세먼지 #안심가전체험단 #진리템
2018.11.01. ,삼성 에어드레서 무료 체험단 모집,삼성에서 에어드레서 무료 체험단을 모집중이네요! *_* 점점 밖에는 나가기 싫고 ㅋ 집순이가 되고 싶은 요즘이지만 늘 출퇴근을 해야하는 직장인 맞벌이 부부인...
2019.02.10. ,미세먼지 저리가라!_[#삼성에어드레서] 체험단 신청합니다,하루 빨리 그런날이 오길 기다리며 삼성 에어드레서 체험단 신청합니다. 삼성 에어드레서 리뷰어 모집 | 삼성닷컴 삼성 에어드레서를 놓고 싶은 공간을 촬영하여 나의...
13시간 전 ,삼성 에어드레서 체험단 모집,엄청 엄청 음청 기대하던 삼성 에어드레서 체험단 모집한대용 ㅎㅎ 바로 응모함요 미세먼지 심각한 요즘 외투는 두꺼워 자주 세탁도 못하고 ㅜ 그럴때 요 에어드레서면...
6일 전 ,삼성 의류가전 에어드레서 체험단 모집중!,낱낱이 파악해서 꼼꼼한 제품 리뷰에 도전하고 싶습니다. 여러분도 에어드레서 체험단에 도전해보세요 ! 삼성 에어드레서 리뷰어 모집 | 삼성닷컴 http://me2.do/F9dkq9Qf
2019.02.03. ,삼성에어드레서 체험단 모집!!!,삼성 에어드레서는 문을 닫아 놓아도 제습기능이 된다는 것을 보고 무조건 이제품으로 해야겠다고 결정!!! 오 그런데 체험단 모집 중인 광고를 보고 나도 한번 지원해...
17시간 전 ,삼성에어드레서 체험단 모집!,오늘은 삼성에어드레서 체험단 모집 마지막 날 집에 에어드레서가 있으면 정말 행복할거 같아요.. 미세먼지필수템 이라는데 가격이 저렴한 편이 아니라서 서민들은...
2019.02.13. ,#삼성에어드레서 체험단 모집,"작년까지만 해도 무조건 LG스타일러였는데, #삼성에어드레서 가 출시되면서 고민이 되기 시작했습니다. 그런데 때마침 #삼성에어드레서 체험단 모집 광고가..."
2019.02.05. ,삼성 에어드레서 체험단을 모집합니다.,"삼성에서 에어드레서 체험단을 모집하네요. 미세먼지도 많은 요즘이고, 이제 큰아이가 교복을 입어야 해서 에어드레서에 관심이 많습니다. 에어드레서가 있다면..."
2019.02.08. ,⭐️⭐️⭐️ 삼성에어드레서 체험단 신청⭐️⭐️⭐️,cid=sec_social_instagram_airdresser_20190201_fashion_mobile #삼성에어드레서 #삼성 #이벤트 #에어드레서 #에어드레서체험단 #고양이 #진정한의류청정 #삼성에어드레서...
